Reviewer,Review,Rating,Expense,Type
Kaneez Abedi,"On Wednesday night i ordered this veg tawa pulao , cost was 250 and it turned out to be the worst. I went to take the home delivery by myself. Pulao was so spicy and the taste was very bad. I don't know what went wrong in making but this wasn't accepted.",2 stars,moderate,Mughlai restaurant
Priyanka R,Best for non-vegetarians. Had veg biryani which was ok ok and not good for Chinese ordered veg manchurian which was so hard couldn’t eat.,3 stars,moderate,Mughlai restaurant
Pramod Shende,"Was planning to go somewhere else but ended up dining here! Boy, it was a great decision. The ambience is great, personnel attending is quite talented and knows how to manage multiple tables. Order was quick and we were made to wait for not …",5 stars,moderate,Mughlai restaurant
GANESH JADHAV,"Nice shamiynan and look created in hotel. Nice dishes too. We tried mutton masala, kabab. This time we tries mutton sikh kabab. Rumali roti and mutton sukha we tried.",5 stars,moderate,Mughlai restaurant
Kingshuk Mazumder,It definitely goes by its reputation at the Best Meat Restaurant of Navi Mumbai. I was recommended by a friend and took my friends here for my Birthday and it was worth much more than what we paid. …,5 stars,moderate,Mughlai restaurant
Rahul Sonkar,Visited rhis amazing mughlai cuisine restaurent with friends and it was totally amazing. Probably the best mughlai food place in navi mumbai. Must visit place. The ambiance is plus point for them as it is totally amazing 😍. …,5 stars,moderate,Mughlai restaurant
Atul Salvi,"Food we order was mughlai Mutton Kepsa
It cost about 1950 rs taste was great, good quantity, 9-10 person can have one full Kepsa rice …",4 stars,moderate,Mughlai restaurant
Shailesh Warang,Overall it is a average eatery to taste Mughlai cuisine. We had ordered mutton dum biryani which ok..but the started mutton Bara was a disaster.  Unwarranted meat prices covered with spices..it was a the big turn off.. they have created …,3 stars,moderate,Mughlai restaurant
P H,Has table seating for 10-11 ppl in booth type seating. Food is quite tasty and staff is prompt. Winter special paya soup was a revelation while chapli kabab was average. Persian thaal had decent sized portions though it was slight pricey imo,4 stars,moderate,Mughlai restaurant
Khalid Baig,"Today 14th Oct , I ordered chic. fried rice and chic. crispy and one malpua ,
food was hopeless especially chicken fried rice I couldn't understand whether it was chicken fried rice or egg fried rice or what with lots of oil in it . …",1 star,moderate,Mughlai restaurant
Gursharan Kaur Nanda,"I am love with their Chicken Tikka Masala  🤤
Ambience is good. There is a lot of privacy because of the curtains. …",5 stars,moderate,Mughlai restaurant
kumar pushpankar,"Today I tried veg Briyani and Veg Tawa Briyani,not at all of good quality  Spices and Beans was used to prepare had wrotten smell.Will not recommend any Vegetrain  to try this and I will also not visit ever to this place.",1 star,moderate,Mughlai restaurant
Yusuf Ansari,"Nice place for dining, if you’re into Mughlai then it’s a must visit place for you.
Must have bhuna mutton and mutton biryani",5 stars,moderate,Mughlai restaurant
Devika Dinesh,"Tried their non veg platter .had kebabs, tikkas  and tandoor
Also tried mutton biryani with tender pieces of mutton
Tried gulab jamun with rabdi and kunafa ..both were good",3 stars,moderate,Mughlai restaurant
Waseem Siddiqui,"Worst Nalli Nihari I ever had... it was so watery like paya soup that it was difficult to eat it with Tandoori or Rumali roti.
Chicken Dum Biryani was very dry and below average.
Chinese food was good.",2 stars,moderate,Mughlai restaurant
R.v. Gowtham,"Food here is very delicious, traditional tastes of North Indian flavours. Chicken could've been slightly cooked better. Good ambiance for family too. Service is also friendly.",4 stars,moderate,Mughlai restaurant
rahul Chatterjee,"I like the food, ambience and interiors, good place to visit with friends and family, I felt like we came somewhere in tents. we ordered Kepsa and i think was average but rest chicken crispy, chicken Manchurian and chicken maharaja with Rumali Roti was awesome.",4 stars,moderate,Mughlai restaurant
Sarath Santhan,"Ahmed Bhai's Bry & Dry is a culinary gem conveniently situated near Nerul station, making it easily accessible. The restaurant's standout feature is its unique Mughal-inspired interiors, offering a floor dining experience that immerses you …",4 stars,moderate,Mughlai restaurant
kashif pawlr,"I ordered mutton Barra ,mutton was very hard
I ordered chicken Barra , it was good
Then I tasted bheja masalas,it was very sweet. …",3 stars,moderate,Mughlai restaurant
Keshav Agarwal,"Ahmed Bhai Mughlai Restaurant is a culinary gem that truly stands out in the world of Mughlai cuisine. From the moment you step in, the warm and inviting ambiance sets the stage for a delightful dining experience. The menu boasts an …",5 stars,moderate,Mughlai restaurant
Saurabh Singh,It was one of the best place to have north Indian cuisine a year back but currently you will not find the same taste every time you visit you will find a different taste in the same order. I personally loved Ahmed bhai for the Biryanis but …,3 stars,moderate,Mughlai restaurant
priyanka majumdar,"We went here for dinner, we tried few dishes in non veg here. The food has excellent quality and a very good quantity. The location of this restaurant is bang next to the main road. They have arrangements for the bigger groups and small …",5 stars,moderate,Mughlai restaurant
Supriyo Banerjee,Food is absolutely great. Price you will feel in budget. Staff approaches should be improved. Seems they are in a hurry.,5 stars,moderate,Mughlai restaurant
Kabir Khatri,"Went at around 6.30 pm on a sunday, and there was nothing ready. Only things available were tawa items and dal rice. It's a big no no if a restaurant can't serve customers by 6.30pm on sundays. The food was good, though!",3 stars,moderate,Mughlai restaurant
vishakha kasekar,The place is really good to hang out with friends and family. Ambience is really good and also the food. Lots of amazing food stuff is available. Non veg tasted nice. But the starters we ordered were not serve hot. And my friends even …,4 stars,moderate,Mughlai restaurant
Pradeep Anchan,"The food was not so flavourful. I had chicken biryani and tandoori chicken. Both were bland. In the biryani, some of the boneless pieces were overcooked. I had also ordered paneer Tikka. That was also bland and the paneer pieces were large chunks. The paneer itself was soft, so it seemed fresh.",3 stars,moderate,Mughlai restaurant
Imran mirza,"This place is located is sector 21 , nerul, diagonally opposite to HDFC bank. There are 3 restaurants and I visited the one which has a cost personal setting. One table can accommodate atleast 8 to 9 people. Service is average, since it is …",4 stars,moderate,Mughlai restaurant
Akash Poojari,"Aesthetically it has a royal look
The staff is prompt and kind but the waiting time is a bit longer once you order …",4 stars,moderate,Mughlai restaurant
Rohan Shingte,"I have been visiting Ahmed bhai past 10 years now..
Not even a single percent of quality in the dishes have changed....
Still the same. Still yummy. …",5 stars,moderate,Mughlai restaurant
Nishant Haralkar,"Great service
Best food for non-vegetarian lovers 😋
You visit with friends and family 👪 ❤️ …",5 stars,moderate,Mughlai restaurant
Brighten Jones,"Poor mgmt, reached there as a single person, he was behaving as if only 2 or more allowed........guys only if u wish to visit as a big family, they will welcome u like a anything....no respect for single person.....very less seats...pls avoid",1 star,moderate,Mughlai restaurant
ROHIT PAWAR,"Well, if you are true non veg lover then this place is perfect for you.
Nice location, nice ambience, amazing tasty food, what else do you expect.
The restaurant has two different sitting locations nearby each other. One with a …",5 stars,moderate,Mughlai restaurant
Prasanna Vaidya,"We came here with high expectations this time. But it is not up to the mark as I had heard from a few of my references. We ordered mutton chap fry and it was quite oily. We did try rumali roti and gravy item, the same oilyness was very much there. Plus the bill was too expensive as compared to taste",2 stars,moderate,Mughlai restaurant
Yuga R_T,"This place is awesome ❤️ great taste, nice ambience.. specially kebab and rabdi malpuva are very delicious 😋 …",5 stars,moderate,Mughlai restaurant
kodak rahul,It definitely goes by its reputation at the Best Meat Restaurant of Navi Mumbai. I was recommended by a friend and took my friends here for my Birthday and it was worth much more than what we paid. …,5 stars,moderate,Mughlai restaurant
Shaikh,"Entered at 7.45 pm full of smell ,Washroom not clean
Told staff to apply room freshner spray but nobody listen sorry to say as a regular guest of ahmed bhai nerul i was really disappointed. Hope ahmed bhai restaurant will come back to same as they was at the time of opening",1 star,moderate,Mughlai restaurant
Mohammed Firoz Ansari,"Visited this place on 31st the restaurant was full and we had waited for 10-15 min for the seat.
We had ordered a chicken platter, khapsa rice and kunafa from this place. …",2 stars,moderate,Mughlai restaurant
Foodadda Mumbai,"This is really a good place to visit. The hygiene that they maintain is really appreciable. The place serves great Mughlai food, seafood & khapsa biryani's 😍😋 …",5 stars,moderate,Mughlai restaurant
Subhojeet Haldar,"Shamiyana eating experience was awesome, you get a alot of privacy.
Food taste was not upto the point and as per price.
Baaki staff were very helpful and we liked the hotel experience more than the …",3 stars,moderate,Mughlai restaurant
Sharukh Patait,Must visit!!! Friendly staff nice ambience visit with friend and family.. my personal suggestions try Chicken boom boom (sizzler) in starters after that chicken lahori with rumali roti or murg musallam with butter naan and jeera rice finish with some mojito or ice cream..♥️♥️♥️♥️,5 stars,moderate,Mughlai restaurant
arpita Phadke.,Amazing food .. chicken is soft and tender.. mutton is juicy and malpua is amazing af!!! A bit unclean but would work,5 stars,moderate,Mughlai restaurant
amit verma,"Visited first time
Ordered mutton meals
Mutton kebabs were the best kebabs …",4 stars,moderate,Mughlai restaurant
Suraj B,Good place for dine in. Ambience wasn't per expectations.,3 stars,moderate,Mughlai restaurant
Sujit Rawat,Food is bit expensive but worth there are different types of seating arrangements mainly suggested for family and friends separately seating and privicy maintain.. Highly recommend Mutton lazeez super se bhi upar ka taste🤩.. due to covid …,4 stars,moderate,Mughlai restaurant
Abdul Nazir,There is delicious dish. We will full enjoy with our favourite dish. Its also valuable price. Not a costly.,5 stars,moderate,Mughlai restaurant
Bharat Sai,The food was good. I tried 2 starters and their iconic mutton biryani. The biryani was awesome the first time and avg in the second round. The starters were good.,4 stars,moderate,Mughlai restaurant
Tanveer Shaikh,Just visited this restaurant yesterday and ordered Chicken Khafsa Rice. The worst Khafsa rice I have ever eaten.request to all customer plz do not order khafsa rice.. Full waste of money on food.. This is my wrost experience in this restaurant..,1 star,moderate,Mughlai restaurant
Chaitali Patil,"Loved this place!The menu is never-ending.Great for chicken and mutton lovers!We had Chicken baida roti, Chicken tandoori, chicken lahori, rumali roti, banjara kebabs and chicken tikka biryani.Everything was so yummy!A muat visit.Dessert was malpua with rabdi, drool!😍 …",5 stars,moderate,Mughlai restaurant
Suprakash Mandal,"Ahmed Bhai

4th February, 2017 …",2 stars,moderate,Mughlai restaurant
AziF,"Had a great experience, food is delicious, ordered khapsa, rabdi, falooda and khunafa. The ambience is nice and well decorated. Best place to hangout and celebration, or party. It's just walking distance from Nerul Station",5 stars,moderate,Mughlai restaurant
abhishek kumar Singh,It was one of the best place to have north Indian cuisine a year back but currently you will not find the same taste every time you visit you will find a different taste in the same order. I personally loved Ahmed bhai for the Biryanis but know i don't think that they have the same taste as before.,4 stars,moderate,Mughlai restaurant
Dr Subia,"If ur taking a dine away, food is still ok, yet very oily.

But if ur planning to dine in, then the ambience toilets all r stinking of goat and sheep.the food served is tasteless and waste of money.",2 stars,moderate,Mughlai restaurant
yogesh keluskar,"Food is good. Non veg platter gets a thumbs up. Tandoori roti was soggy. Not very friendly staff, intimidating.
Good seating arrangement.",3 stars,moderate,Mughlai restaurant
Laeek Siddiqui,"Best place to have Mugali Nonveg food in the Nerul Area even in Navi Mumbai. One Must try Nalli Nahari (for Mutton lovers) and Nahari shoup.
Mutton and chicken biryani is also awesome. …",5 stars,moderate,Mughlai restaurant
Isa Shaikh,"Top notch Mughlai cuisines !
Multiple visits and was never disappointed !
Do order Chicken Boom and Dhamaka as they are fabulous ! …",4 stars,moderate,Mughlai restaurant
Rishabh Verma,"If you stay in navi mumbai or you are visiting Navi Mumbai and you want the best mughlai then ahmed bhai is the place you must visit in Nerul.
We got a heartly welcome from the staff, they were polite and friendly, the …",5 stars,moderate,Mughlai restaurant
Nithin saji,Me and friends had mughlai mutton kabsa today.Rotten mutton was served which was smelling bad.All of us had food poisoning.Very bad experience from Ahmed Bhai.Inefficient in maintaining food quality and standards.A glass of lime soda cost 110rs.Very costly.10 times the actual cost.,1 star,moderate,Mughlai restaurant
Tasneem Sehorewala,"I liked this place & their food is awesome.
They have dining as well as dastarkhan. Chicken & mutton varieties are always yum. Their tricolour chicken dish is a must try if you are going with family or …",5 stars,moderate,Mughlai restaurant
shub7pute,"Higher Value and Lower Quantity..
Not expected on this price getting very low quantity",1 star,moderate,Mughlai restaurant
Sofia Malik,Food is pretty average.  Unnecessarily Hyped up the hotel. Mughali cuisine is good. Chinese is a big no. Totally not their specialty.,3 stars,moderate,Mughlai restaurant
prachi bapat,"I loved the place. We ordered Lahori kabab, rumali roti, laccha Paratha and murgh mussalman. All the items were so tasty and yummy. Service was also good.
Good atmosphere.",5 stars,moderate,Mughlai restaurant
Shubham Negi,Has table seating for 10-11 ppl in booth type seating. Food is quite tasty and staff is prompt. Winter special paya soup was a revelation while chapli kabab was average. Persian thaal had decent sized portions though it was slight pricey imo,4 stars,moderate,Mughlai restaurant
Saurabh Shetkar,"Aura in this place is very nice. Overall privacy for couples and big shamiyana for group of people were maintained very peacefully. Decent food quality and at the same time, quantity was also nice. It is a place situated near Nerul railway station, which is worth visiting.",5 stars,moderate,Mughlai restaurant
sachin prasad,"Visited the place during Ramadan.... Had two sweet dishes.... Malpoa with rabdi and Turkish Kunafa..... Had tried Kanufa for the first time...l liked it.... Went again and had Al baik fish (basa), chicken lungfung soup, mutton bheja fry, …",3 stars,moderate,Mughlai restaurant
Susindran Buddha,One of the best place to have authentic non veg food. Every dish you taste would be the best you have ever had. Good place to enjoy and have great time with friends and family.,5 stars,moderate,Mughlai restaurant
meryll alva,Awesome place. Simply wonderful staff and yummy food. Everyone should try at least once. The non veg platter is a must try. !,5 stars,moderate,Mughlai restaurant
Halima Qureshi,Awsm food 😋 😍 👌 great quality delicious tast u must try maal pua with rabdi …,5 stars,moderate,Mughlai restaurant
Runner Ghosh,"Nice joint for non vej food., reasonable, amount per serving ok. Quaint place ahead of Nerul station, try various muslim cuisines like falooda. Rabdi malpua, repretoire of kababs, tandoori items. Price is reasonable though cannot be told to be low. Has a dedicated clientele. Family seating available with low tables and seats.",4 stars,moderate,Mughlai restaurant
Sahana Sahana,"Food we order was mughlai Mutton Kepsa
It cost about 1950 rs taste was great, good quantity, 9-10 person can have one full Kepsa rice …",5 stars,moderate,Mughlai restaurant
Saman Usmani,Worst service ever. We entered restaurant then they asked us to wait outside.  We waited 10 minutes outside then half an hour to order and for our food. Plates were not clean. Atmosphere was so pathetic evrything felt unclean and unhygienic. Would not recommend.,1 star,moderate,Mughlai restaurant
puneet advani,"The place is always crowded, the food is yummy and the staff is really helpful. We had ordered Rumali papad which was really awesome, I have added the pic for the same. It's different version of masala papad. Loved the food and the yummy kebabs. The wait was a little longer like 35-40 Mina's we were a group of 20 people.",4 stars,moderate,Mughlai restaurant
Jawalkar neha,As always we order muglai kepsa rice. But 2 times we didn't get mayonese (craving item &main item of plate) and waiters were rude as they did not apologize and only gave excuses.,3 stars,moderate,Mughlai restaurant
73 Ajit Bagi,"If you are looking for a place to stuff yourself with good food , then this is the place .
It is located near nerul railway station . Not much to see in interior , it's …",4 stars,moderate,Mughlai restaurant
omkar deshmukh,"Ahmed Bhai's Bry and Dry, Nerul. Decent place to hangout, a bit rustic and Moghlai look. Good place for family. Suggestions to only try the biryani as starters are not worth for money.",3 stars,moderate,Mughlai restaurant
Pankaj Obhan,"Ordered butter Chicken tawa boneless , wich came with bones after sharing photo also no call received for apologies or replacement , order banjara kebab, not delevered after 1 hour also, when called, Reason given no, delivery boys …",1 star,moderate,Mughlai restaurant
Pranav Jiddewar,"If you're in the mood for some delicious Middle Eastern cuisine, look no further than ""Ahmed bhai's."" From the moment I walked in, I was struck by the warm and inviting atmosphere, with rich colors and exotic decor. The menu boasted a range …",5 stars,moderate,Mughlai restaurant
Minhal Abidi,It was an average experience. The non veg platter tasted average. The service was also just so so. Better options available nearby,3 stars,moderate,Mughlai restaurant
Priya Fadikar,"Awsum ambience.. Perfect dinner place for family, friends etc... Loved the atmosphere.. Yes its little bit costly bt worth it... Will get a feeling of being Nawab😆...must try ckn biryani.. …",5 stars,moderate,Mughlai restaurant
Rishav Sinha,I came here after suggestion from one of my friend. An awesome place to have non veg food. I went here for dinner. …,5 stars,moderate,Mughlai restaurant
Prrathamessh Loke,"Very Bad experience. The size of Roti and Nan was very small,  about 70% of what you will get outside. Ordered 4 dishes.  Out of which chicken hariyali and chicken memani had little to no taste thus asked to parcel them after having a …",1 star,moderate,Mughlai restaurant
Lokesh Patil,"Non veg Lover must visit Ahmed Bhai's.
Roomali Roti is The Best.
I would rate there services as …",4 stars,moderate,Mughlai restaurant
Sailesh Srivastava,"Ordered chicken tandoori chat... As per description, it is served with chat.. however, received tandoori chicken tossed with jaggery sauce... Useless item... And worst customer service....😡 …",1 star,moderate,Mughlai restaurant
Nikhil Mhatre,"Liked the place. Food was really good slightly high in rates but great taste. Ambiance is good, well their service was slow but doesn't matter if the food is good. They have variety of dishes available must try chicken Tikka biryani. Overall good place for nonveg lovers.",4 stars,moderate,Mughlai restaurant
Jayant Shah,Overall experience was good nonveg foods are all very topnotch just the thing is that veg dishes are not recommended over here just average tasting and flavor over here and some dishes are overpriced,4 stars,moderate,Mughlai restaurant
kash p,"I went there twice ,ordered chap barra,chicken barra,bheja masala none of them is even close to avg ..they should improve on food taste …",3 stars,moderate,Mughlai restaurant
vikrant ghanekar,Close to Nerul station. Roadside parking available. Food is really good. Cosy ambience. Serving staff is average on hospitality manners.but a must visit place for non-veg foodies.,4 stars,moderate,Mughlai restaurant
Shaheen Khan,"The food was okayish , price was more considering the quality and falooda was just disgusting they don't how to make falooda there were frozen pieces of mango and it was very thin. The waiter seems to have no interest in serving food.",3 stars,moderate,Mughlai restaurant
Naela Tisekar,"One of my favourite place to dine in with family and friends.
Ambience ✅ Food ✅ Service ✅
Murg Musallam is a must try.",5 stars,moderate,Mughlai restaurant
Avez Gorme,The food is good but expensive the service is took good the hotel is located in nerul the butter chicken is too good and tandoori the manager is good in behaviour and it's good,4 stars,moderate,Mughlai restaurant
Zahida Shaikh,Stones in the food. Rabri is spoilt. Taste very bad. Not a good option,1 star,moderate,Mughlai restaurant
Akshay Chodankar,"A well know joint in Nerul..best for any kind of nonveg cuisine..Dum Biryani, murg mussalam with rumali roti, aggara kabab or any kabab for that matter, they got the best of it.. …",4 stars,moderate,Mughlai restaurant
Anish Sole,The dish here is know as Chicken Kapsa Biryani. I was told this dish serves for 7-8 people but its not true. Only 6 of us ate this and still was not fulfilling for few of us.The taste is okayish. The price is very high as compared to the quantity of the dish.,2 stars,moderate,Mughlai restaurant
Swapnil Padelkar,"Really Nice quality of food and quantity more than ur expectations

Sizzling starter are just awesome and surprisingly you will get very good option …",5 stars,moderate,Mughlai restaurant
Sudhanshu Bhagat,The taste is amazing. We ordered Chicken Tandoori Biryani the quantity is more than enough for 5 people price is also perfect. Quality and quantity both are great.,5 stars,moderate,Mughlai restaurant
Rahul Bhoir,"Months before,  this place was great for food but now its all gone. The seating used to be good with clean curtains but now the curtains are dirty and even the couch is dirty.  I asked for water which was not provided till the end I'm sure …",1 star,moderate,Mughlai restaurant
Akshay Dalvi,"Ordered Chicken Mussalam and rumali roti...
It was worth a price...! …",4 stars,moderate,Mughlai restaurant
Vipul Salunke,"Good taste and place so hygienic.
Staff is so good and the I loved most the seating arrangement.",4 stars,moderate,Mughlai restaurant
Perin Amrolia,Didn't like the biryani at all. Too much masala in chicken Tikka biryani and very dry in chicken dum biryani.,2 stars,moderate,Mughlai restaurant
zuha shaikh,"Despite the hype, the food at this place lives up to its reputation. Flawless flavors make it a worthwhile experience for any food lover.",3 stars,moderate,Mughlai restaurant
Arunava Pramanick,"Excellent place for non veg lovers. Would recommend the mutton seek kebabs, bheja masala fry, gurda masala fry and rumali. Service is good.",5 stars,moderate,Mughlai restaurant
Madhuja Chauhan,It's the best place to have lucknowi e and Hyderabadi mughlai khana in Navi Mumbai,5 stars,moderate,Mughlai restaurant
Farhan Khan,Had a great time... all peny worth it... do try garlic sauce prawns and fruit salad with ice cream,4 stars,moderate,Mughlai restaurant
SIDDHESH THAKUR,One of the best places for nonveg lovers.,5 stars,moderate,Mughlai restaurant
Mush,"Oh my God..!! ""Maalpuwa"" ka nam lete hi mu me pani aa jata hai... In ramzan dey make some special dishes ...one of my favourite is ""Halim"" ... Food is also very tasty n delicious..sitting arrangements,parking, food everything is just awesome 👌👌👌👌👌 …",5 stars,moderate,Mughlai restaurant
Hemant Shinde,"The food has been tasting good since last 10 years here. Only the rates have been increasing, and rightly so. …",5 stars,moderate,Mughlai restaurant
Pratap Sinngh,"Worst experience ever. get treated like a beggar. Manager says his name is ""Mr Mass"" "" Jo karna hai karle bhikari""",1 star,moderate,Mughlai restaurant
Ashfaq Khan,"Food Quality is excellent and menu is big enough. Pricing is affordable.
Service can get better and staff needs to be more polite and helpful.
Very busy place. …",1 star,moderate,Mughlai restaurant
Abdul Azeem,"This is very good place to have dinner with family , i love the food and ambience , very rich in mughlai dishes and their malpua is bestest😊😊😊 …",5 stars,moderate,Mughlai restaurant
Asha pokuri,"Its is a Mandi restaurant

Chicken juicy mandi is awesome …",5 stars,moderate,Mughlai restaurant
Tanveer Kazi,"Ahmedbhai Bry and dry is an awesome place in nerul which is worth a visit.
Place is good with with good sitting arrangements.
Highly recommended Murgah mussalam - it's sufficient for 5-6 people . And also …",4 stars,moderate,Mughlai restaurant
