Reviewer,Review,Rating,Expense,Type
Navin S Goyal,"The place wasnt worth a single penny. First of all it was friday so it was supposed to start a bit late so we were ok to it. Then the guy told us he needs to offer namaz and hence he will allocate another guy for taking orders, that was …",1 star,moderate,Mughlai restaurant
Ganesh Damiwal,The best place to have non veg. Restaurant has a very nice ambiance and  Great food at a great price! Love the chicken lollipop tandoori well as the salads. Love this place!,4 stars,moderate,Mughlai restaurant
Alka Vijan,Some great mughlai dishes to try here...have been here many times and will continue coming as the quality as well as quantity is too good! Reasonable price..shamiana Ambience which seems great and comfortable!,5 stars,moderate,Mughlai restaurant
chandraguptha rajah,"It is a well recommended for chicken briyani and  tandoor chicken    The way , the cleaning of chicken was  seen by me accidentally, it is ok but of the quality people talked about in the internet.  Prices  wise is ok , not much cheap.
Try once",4 stars,moderate,Mughlai restaurant
Farhan Dhanshe,Mutton Haleem during Ramadan is mouthwatering,5 stars,moderate,Mughlai restaurant
Piyush Pilare,"Didn't have a good experience.
Please serve the tastier food for the cost you charge.
Khichdi would taste better than the Chicken Dum Biryani you served.",1 star,moderate,Mughlai restaurant
Atul Mane,Fantastic and very tasty chicken,5 stars,moderate,Mughlai restaurant
Lubna Memon,"The fish Al baik was excellent...chicken Lebanese tikka was good ..the boom boom chickgryn was nice but too spicy...mutton fry was average
N again spicy.meat was too chewy..mutton biryani totally lacked lustre..would never have a biryani there again....service was good..Sunday night 119.30 pm n no place to sit....",3 stars,moderate,Mughlai restaurant
Kedar Gokhale,"It has shamiana type compartments which gives you good privacy. But the ambience is dull. The curtains are dirty. So overall its no welcoming.
Tastewise, most food items has same taste and not so tasty.",2 stars,moderate,Mughlai restaurant
Rishabh Sawant,Pricing is too high as compared to the taste not really worth the price. Quantity is decent 2 people can eat one plate of biryani.,3 stars,moderate,Mughlai restaurant
Irfan Abdul,Raan biryaani is it's speciality. You have lot of Arabian cuisine options here. But it's bit on expensive side when compared to nearby similar kind of restaurants.,3 stars,moderate,Mughlai restaurant
Musa,Worst food service.  Their quality is degraded day by day. The worst chicken chilli I had.   Served with chicken Tikka pieces in Chinese. More over the quantity is like one forth empty.,1 star,moderate,Mughlai restaurant
Nishant Shinde,"Chicken kalimiri was yummy..
Really disappointed by chicken dum biryani as the biryani had very little masala and also lacked taste with just 3 pieces of chicken.. Never ever order chicken …",3 stars,moderate,Mughlai restaurant
chetan patil,"Good moghlai non veg food

Seating arrangement is exceptional. …",4 stars,moderate,Mughlai restaurant
madhavi Phadke,Worst place visited ever... Food was tasteless. Ambience is not at all like photos.... Food quality is worst... No proper services received.. staff is very bad... unhygienic place.... Uncleaned.... Don't even want to give single star....,1 star,moderate,Mughlai restaurant
Fayyaz Ahmed Khan,Good place... Nice service... Not to miss Mutton Keema.... Tandoori roti was good as well... Chicken lolly pop was lemony but Banjara kebab was so so... Will try some new things next time cos they a lot of variety!!! All n all a good restaurant😀 …,4 stars,moderate,Mughlai restaurant
AsLam NaDaf,Ahamad bhai's biryani is all time favourite ❤️💯 …,5 stars,moderate,Mughlai restaurant
Rahul Naidu,The place is very nice but the person who takes the order was very rude as if he is going to pay the bill and we asked many time to clean the table but he didn't even give any attention i would give zero star if possible please think before going here,1 star,moderate,Mughlai restaurant
Prathamesh Utekar,Variety of delicious chicken dishes.nearby from nerul station.,5 stars,moderate,Mughlai restaurant
Shamina Sayed,Good place and they serve fresh food.staff claims that they don't keep stock in fridge and give the same to customers.staff is also disciplined and good,5 stars,moderate,Mughlai restaurant
satyajit suklabaidya,"Decent Muslim restaurant.tried haleem for the first timetime. Also tried the cheese paratha, was good enough but quite heavy.rush during ramzan months",4 stars,moderate,Mughlai restaurant
Prerna Kamble,The food experience here is just awesome. Awesome dishes. Specially roomali roti and bheja fry. Kunafa was awesome in desserts.,5 stars,moderate,Mughlai restaurant
Ajaj Inamdar,Don't weste your time to come here and wait here for 1 hrs or more than that.ac are not working. This restaurant is worst that i saw in my life.this is my personally experience to this restaurant.,1 star,moderate,Mughlai restaurant
Farhan ZR,"Be careful with your orders,
I had ordered mutton and they delivered chicken and refused to accept their mistake. …",1 star,moderate,Mughlai restaurant
Tushar Palande,Was a let down considering its ratings on Zomato. Food and ambience were strictly OK. Shamiana section was a bit stuffy. Overall not a very pleasant experience for a family dining.,3 stars,moderate,Mughlai restaurant
Imran Pathan,"Hey ! EVERYONE

Went To Ahmed Bhai's Bry & Dry , To Celeberate"" HAPPPY PARENTS ANNIVERSARY "" …",3 stars,moderate,Mughlai restaurant
ANIKET PATIL,Guys dont order food online from ahmed bhai... i order mutton biryani its not good mutton is hard as rubber not fresh ata all.raita is also not fresh at all...tandoori i order i ok ok but quantity is less...i will not order food online from ahmed bhai..,1 star,moderate,Mughlai restaurant
Rituparna Das,"It is a very good place to have Biryanis in yhe restaurant but incase you stay far and want to take food home, then would suggest you to have somewhere else because packed Biryanis didn't taste that good when I bought.",4 stars,moderate,Mughlai restaurant
Theophilus Solomon Daniel,"The mughlai food served here never ceases to Amaze me! Fantastic roganjosh, mouthwatering gulab jamuns, silky rumali rotis and the best butter chicken in Nerul.",5 stars,moderate,Mughlai restaurant
mohit Agrawal,The king of non vegggg love the food,5 stars,moderate,Mughlai restaurant
Prakalpa Shelar,The non veg dishes were good. This place has quite good ambiance.,5 stars,moderate,Mughlai restaurant
KHAJA BABA Shaik,"Ever needed haleem in Ramadan time..?
Then. This is the correct place to visit.. especially hyderarabadi haleem.. loved it.,  Reminded me of home.. …",5 stars,moderate,Mughlai restaurant
Mudita Pawar,"Loved this place and delicious food.. specially love seating arrangement,can have private lunch and dinner with curtains closed.. non veg lover should try on",5 stars,moderate,Mughlai restaurant
Mayuri Deshmukh,"We order chicken khapsa for 7, quality and quantity were so good. Also, the seating arrangement is awesome, personally I like this place",5 stars,moderate,Mughlai restaurant
Umar Ansari,"Taste was good, and cost was also affordable, but we can't book the seats before. Overall a good restaurant.",4 stars,moderate,Mughlai restaurant
Deepak Gaarg,Very good food. This is the best non veg restaurant which has all the dishes and every one is so authentic that you will love it,5 stars,moderate,Mughlai restaurant
Gauri Patil,"It was worst... Service was poor, food quality and cost of food is also not worthy. I would not recommend any one of my friends and family to go have food at Ahmad bhai..  I ordered paneer tikka role it was cold and bland tasteless, Biryani was dry, chicken chilly was disaster. Pathetic experience",1 star,moderate,Mughlai restaurant
shujaat Kapdi,This place used to be good but now it's same masala for all items.Very unhygienic places.During Ramzan they shot the price very high.. Not Recommended at all..,3 stars,moderate,Mughlai restaurant
Uppal Sarkit Teja Netha,There’s nothing more romantic than Italian food,5 stars,moderate,Mughlai restaurant
mohammad.zabiulla baig,Food is really very very nice,5 stars,moderate,Mughlai restaurant
Aditi Kapadiya,Veg. Manchurian Good taste Best restaurant and food at very affordable prices. Must visit place . Good for family as well as group of friends.Best place to have dinner with family.. Overall very Good experience for me..,5 stars,moderate,Mughlai restaurant
Nandkishor Patil,"Very well known for non veg item one of the best in Navi Mumbai for Afghani, Mughalai food kabab, biryani, Kapsa rice etc. Most go",4 stars,moderate,Mughlai restaurant
hitesh tailor,"Best place for paya soup, I don’t eat non veg but I alway take my parents here for their dinner.",5 stars,moderate,Mughlai restaurant
Dr.Fuzail Ahmed,Good taste and nice ambience,4 stars,moderate,Mughlai restaurant
Asrar Ahmedd,"The Food is quite good but cost is bit high and the food is full with flavors but if you are the one who is looking for spicy,hot,exotic foods , than dude u 've googled a wrong place",3 stars,moderate,Mughlai restaurant
Krantikumar Gaikwad,This restaurant is loosing it's charm. Food is OK but dine in experience is not upto the mark.,3 stars,moderate,Mughlai restaurant
Afzal Hamdulay,Previously it was awesome. But now the service is a little bit slow and they don't pay attention to youngsters for taking orders when a family is sitting on other tables. The kitchen needs to be a little bit clean.. otherwise food is always awesome most of the times. But little bit expensive..,3 stars,moderate,Mughlai restaurant
Jibin Prasad,"Best place in nerul to have non veg .Amazing kabsa, rann biriyani,mutton bheja fry,rumali potti,pahadi panneer .service is ok ok. But food is great and ambience is good .liked it",4 stars,moderate,Mughlai restaurant
Samad Patel,"place was really smelly, poor ventilation won't recommend their tikkas and biryani, may go for chinese...",3 stars,moderate,Mughlai restaurant
Sachin Shakya,"Everything just awesome, but still giving 4* becoz less variety of drinks like mojito and dessert not in stock. Food is delicious and quality quantity 5*.",4 stars,moderate,Mughlai restaurant
Sabrin Shaikh,Loved the paya soup... All starters are great.... Awesome ambience,5 stars,moderate,Mughlai restaurant
Manoj Ruhal,Great taste in non veg varieties.. I had tasted mutton,5 stars,moderate,Mughlai restaurant
Naziya Mohammed,The food offered in this place is brilliant but service is pathetic. The servers are very rude and loud. I ordered Butter naan n was delivered rumali roti. Wrong orders placed. This hotel needs to work on its Hospitality.,3 stars,moderate,Mughlai restaurant
Sneha Gharat,One of the best place for chicken lovers,5 stars,moderate,Mughlai restaurant
Prasad Posam,"Lots of menu choices, good non veg dishes. Don't miss the malpuva during Ramzan. Getting parcels is a messy affair.",4 stars,moderate,Mughlai restaurant
Rajesh Srivastava,It's a best place for lunch & dinner with friends and family,5 stars,moderate,Mughlai restaurant
Lata Todankar,My experience was very good....I have been there for the first time. After my first visit I would like to go there again because I liked that place very much . I ordered fried rice nd shawrma  both were very good in taste  I would like to visit it again,5 stars,moderate,Mughlai restaurant
shruti mumbaikar,They have a very good planning done keeping in mind space for customers. With curtains like a room and the food tastes delicious 🙌 …,5 stars,moderate,Mughlai restaurant
PUSHPESH SINGH,Place is good for dinner with freinds and family. .. Biryani is best. Some orders do take time... But worth of waiting.. Staff is also quite cooperative,5 stars,moderate,Mughlai restaurant
Satvik Nema,One chicken tikka biryani is enough for 6 people. The rice was THE best I had.,5 stars,moderate,Mughlai restaurant
Aniket Apurv,An awesome place to hangout with your family and friends. Foods with good quality and taste at affordable price. I visit every time when I go out for dinner... Great place..,5 stars,moderate,Mughlai restaurant
Yashraj Deshmukh,"I loved the Nalli Nihari and kaleji Fry...
loved the style and ambience of the restaurant....",5 stars,moderate,Mughlai restaurant
Yogesh Chand Thakur,5 stars for food and 1 star for ambience. I cannot sit there and eat my food. The restaurant has a negative vibe to it. I prefer take aways from here.,3 stars,moderate,Mughlai restaurant
Irshad Firfirey,They offer Good food at good rates. However used to be amazing food a few years back. I believe the taste has changed over the years. Can do better.,4 stars,moderate,Mughlai restaurant
swati dewan,Best place to have kabab and tikka,5 stars,moderate,Mughlai restaurant
tushar talkar,Great place for party.....I visited many times....best rates...tast is amazing...always order rumali roti...butter chicken...mutton kadai.... Awesome taste... dil khush ho jata hai...best sitting arrangement...there is two sitting arrangements...one is pandal and second is lower sitting..,3 stars,moderate,Mughlai restaurant
RANJEETSINGH KORANGA,Food was good not place,5 stars,moderate,Mughlai restaurant
Mohammed Ali Siddiqui,Excellent taste. Great food... however I would strongly suggest for better maintenance of the place in terms cleanliness and hygiene....,4 stars,moderate,Mughlai restaurant
Sangram JC (Baby Pegasus),Had a taste of Malai Chicken and Experienced the fantabulous taste which everyone told me about.Make sure you're hungry before entering this restaurant because trust me... You're gonna eat alot!Have fun!,5 stars,moderate,Mughlai restaurant
Anmol Saxena,"A great place to visit with family..
Ambience is good
Food quality is pretty good..though the quantity i felt is little less according to the prices.. otherwise it's a must visit place:)",4 stars,moderate,Mughlai restaurant
harshad mhatre,"Average taste
Quite overpriced
Quite pathetic service and the waiters are arrogant enough to say we don't …",1 star,moderate,Mughlai restaurant
Swapnil Chorat,I went there with my friends and i had an awesome experinece specially the non veg biryani that was superb can still fell the taste and service was also nice and the ambince was silent,5 stars,moderate,Mughlai restaurant
Rajiv Gupta,"The food was great but the average preparation time is 30 minutes. If they could reduce preparation time, it would be great.",4 stars,moderate,Mughlai restaurant
Vandana Dandage,Amazing mouthwatering food served here!,5 stars,moderate,Mughlai restaurant
Sunny Dowari,"everything is made in butter or ghee, rich taste and mouth watering aroma, love all of the items that Ahmed bhai offers, love the ambience in the restaurant, don't go regular here as much as i want to.",5 stars,moderate,Mughlai restaurant
gaurav nagotkar,This is what Kunafa served for 160rs dissatisfied with services. Even other ppl were unhappy with services,1 star,moderate,Mughlai restaurant
Aniruddha Guha,This place is good for non-veg lovers. The food quality is good and it's taste good too. Food presentation is good as well and best part is that you can get a privicy here while you enjoy your food with family or friends. As they have table …,5 stars,moderate,Mughlai restaurant
Sachin Mishra,"I didn't like food quality and it was served with poor service, waiters don't have basis hospitality skills, they call you Bhai instead of Sir or anything else. Food was very expensive also",1 star,moderate,Mughlai restaurant
Manasa Menon,Food is really tasty! They can still try and work on the ambience and the place. Its quite old and a little congested to move around! The food is amazing👏👏 …,4 stars,moderate,Mughlai restaurant
saurabh dabhade,Worst biryani I ever eat…. If dum biryani is best biryani of Ahmed bhai then u need to start inventing what is biryani…worst experience…,1 star,moderate,Mughlai restaurant
Ahmed Makda,"Awesome food, no doubt the best hotel in the area in and around Navi Mumbai. The best part is the shamiana sitting and teh dastarkhan and no doubt the overwhelming and delicious food that the place has to offer.",5 stars,moderate,Mughlai restaurant
Priya Gupta,A good place n a good quality of food they provide n the best service too.Guys plz visit this shop u will be most happy to eat spclly nonveg items...❤Even the rates are reasonable.A good shop to visit with famalies n frnds.,5 stars,moderate,Mughlai restaurant
Almas Khan,"Good food,nice ambience but poor service.
Washroom and kichen next to each other.
Only one washroom which is common for both males and females",4 stars,moderate,Mughlai restaurant
Saurabh Patil,"The quality of food is good but the quantity didn't please me. It was very less. Delivery time for me was also not good. But, at the end of it, quality of food was good, so no regrets on that front.",4 stars,moderate,Mughlai restaurant
Animish gandhale,"Good Ambience,  comfortable sitting,  Best part is Privacy with Shamiana type Curtains, Authentic Mughlai and other dishes,  Friendly staff.",4 stars,moderate,Mughlai restaurant
Vignesh Sundaram,Food was good and worth eating but issues was Bisleri bottle was charged above MRP both room temperature and cold(20rs bottle was charged Rs 25 and service was too slow even when the restaurant wasnt that much crowded..overall a bad experience..so I would only recommend this place of you have got apmle time to kill.,2 stars,moderate,Mughlai restaurant
Vihang Prajapati,"One of the best place for non veg lovers. If you are going with your group, I'd recommend you to reserve your place. Ambience is good. Food is great.",5 stars,moderate,Mughlai restaurant
Sabu Mathew (SPLENDORS OF NATURE),"We explored the Dastarkhan and it was good. We ordered the Hakeem, Seekh kabab and Biryani. Nice place to explore Mughlai cuisine.",5 stars,moderate,Mughlai restaurant
amit chapper,"Superb for non-vegetarians, their motton dishes are awesome",5 stars,moderate,Mughlai restaurant
MILIND JADHAV,Good food offered. Quantity served is also good. Must improve untidy front. Jalebi n roti section not maintained good.,3 stars,moderate,Mughlai restaurant
akira khan,I love the food taste but the Service is too late but in that u enjoy tym with cosy seating...,4 stars,moderate,Mughlai restaurant
Anitha Kumar,"I just visited just now and what we ordered had really bad experience as green chutney was too salty,chicken reshmi was half burnt,mutton seekh kabab was not juicy at all rather hard to eat,on top dum biryani just spoiled our over all mood, …",1 star,moderate,Mughlai restaurant
Aniket Paul,Visited at around 5:30. Tandoor closed between 4pm and 7pm so was not able to enjoy any tandoor dishes. Biriyani here is great.,3 stars,moderate,Mughlai restaurant
Aarti Gupta,"Best place to with family, Friends. Best for non veg there is very few dishes for vegetarians.",5 stars,moderate,Mughlai restaurant
KAZEEMA KAZI,"I'm not sure why I'm even giving this one star also,but anyway.The person reading this review now, I would like to say you that please just don't depend on the ratings of 4 stars and the overall ambiance of this restaurant, because this …",1 star,moderate,Mughlai restaurant
Devendra Gujarathi,"Kabab taste dropped,chewy",1 star,moderate,Mughlai restaurant
Saqib Mukri,Nice food.. the service was great... Ambiance was a let down... Overall a nice experience... Rabdi jalebi a must try.. request him to bring it hot...,4 stars,moderate,Mughlai restaurant
jacob vedanayakam,I always prefer this place because of the good taste & service,5 stars,moderate,Mughlai restaurant
Shazmeen Shaikh,This is an amazing place for all the chicken lovers. The ambience is quite and royal. Only bad thing was a few waiters were continuously staring.,4 stars,moderate,Mughlai restaurant
Harsh Patel,"Brilliant taste ,outstanding service ,😃😃😃😃😋😋😋😋loved the place both the quality n quantity is awesome ,paneer bhuna and jalebi was best taste I ever had.. I recommend best place for dinner with family. …",5 stars,moderate,Mughlai restaurant
Dipti Bandkar,"earlier its food quality and service was good but when I went this time the food quality as well as service was so poor, they didn't serve the food just kept it on table and ran away and the biryni was just masala rice.",2 stars,moderate,Mughlai restaurant
Girish Panda,"Pros :They offer authentic Muslim food, one should definitely try there Rumali roti and Murg mussallum …",4 stars,moderate,Mughlai restaurant
Hanif Surve,Very good place to enjoy tasty Non Vegetarian food.Good place for families.Its not very upscale but if you want tasty starters and tasty food you  can visit.Service is good.Saturday Sundays you may have to wait for 15 to 30 minutes.They take orders and send food home.Reservation of seats/table is acceptable.,4 stars,moderate,Mughlai restaurant
Bushra Sastikar,Worst experience ever! The service is so slow and pathetic. The quality of food was bad. The chicken was uncooked. Waste of money. There is no staff manager present. No one cares about the costumer.,1 star,moderate,Mughlai restaurant
Sindhu Chauhan,Best quality food....nice place for dinner with family . It is good restaurant n good staff and service... 👌 …,5 stars,moderate,Mughlai restaurant
Suyash Mandloi,"Great taste, good food nice authentic mugalai briyani and other stuff. Great vegetarian food too. The atmosphere is good too",5 stars,moderate,Mughlai restaurant
Kinjal Viradia,I went yesterday to this restaurant with my hubby.. i really enjoyed d food .. actually this is the best place for non veggie but i m vegetarian so i order veg dum biryani n rumali roti n veg kadhai.. teast is proper not so spicy n not so …,4 stars,moderate,Mughlai restaurant
Sapna Singh,Best place for dining with family and friends. ..good place for non veg lovers.. ..Quick service for any orders .....veg is also good ....Quality are osm. .,5 stars,moderate,Mughlai restaurant
Shweta Shukla,"Even though it offers a wide variety of dishes, the serving staff is arrogant. Ordered food at home once and it took more than 2 hours for the delivery which is way too much considering the distance..poor management of home deliveries. Hope they hire delivery personnel's to keep up with the delivery schedule.",1 star,moderate,Mughlai restaurant
Suraj Sable,Faltu food worst taste in Chinese before u order plz check review guys,1 star,moderate,Mughlai restaurant
Yusuf Wadkar,"Ambiuence is Good , Food is very Expensive
Tawa dishes are worth money, never try Chicken Chilli Milli",2 stars,moderate,Mughlai restaurant
SHAIKH AHTESHAM,Worst food and service I have ever face in my whole life style..I m hardcore non veg person having at least 5-6 days week .....We went there with lot of expectations but sab paani me milgyi.....Not a single starters from what we ordered is …,1 star,moderate,Mughlai restaurant
MLal B,Taste is good but quantity is less and price is high. Had ordered Mutton Pulao but received rice resembling fried rice,3 stars,moderate,Mughlai restaurant
Anthony Rodrigues,"Ahmed bhai is one of the best hotels out there.It feels and looks good from inside and they provide best service.I was with my family and had ordered chicken tandoori,keema fry,chicken fried rice,chicken tandoori roti and in Desert we had …",5 stars,moderate,Mughlai restaurant
Yawar Khan,Good place to enjoy delicious veg & non veg food. For veggies try veg crispy and non veg don't mis delicious bheja fry,4 stars,moderate,Mughlai restaurant
Asif Ansari,"Go for Taste & good quality food.
many options on chicken dishes also try one of the greatest desert  'gulab jamun with Rabdi mwlai'.",5 stars,moderate,Mughlai restaurant
patel Sonam,It's was aswomee food . Service was excellent and I had great time with family n friends. For party it's perfect places for celebration.... Thanks for food treatment .. …,5 stars,moderate,Mughlai restaurant
priyanka yadav,"Taste is Awesome, quality good,
I will suggest
Please try chicken Patiala with Resham Paratha",4 stars,moderate,Mughlai restaurant
HrushiKesh Reddy,Place is ok to have dinner 🥘 very nice decors little more hygenic to be maintained.  I had been here during ramzamtime. Available hyd haleem. …,3 stars,moderate,Mughlai restaurant
bhavesh mahajan,no doubt u get best non veg food here but 1 thing this place was lacking is fast service may be there mst be staff issue but do try this place as its centrally located near nerul station nd owner is also very well guy,3 stars,moderate,Mughlai restaurant
Muktanshu Singh,Not good for Veg. Non veg biryani is awesome. Quantity served is ample. Don't forget to have sweet pan outside.,3 stars,moderate,Mughlai restaurant
Swapnil Tipnis,"These stupid chaps dont even know how to make chicken roll. You order a chicken roll and u get deep fried ""Oil chicken roll"".. If American found the amount of oil in chicken roll, they will surely plan to invade..",1 star,moderate,Mughlai restaurant
Shubham Ambekar,"Today i visited ahmed bhai , initially the decor and ambience was pleasent enough❤️ i order a full plate of khepsa, the food was delicious and the price was also affordable enough ❤️ i will try Ahmed bhais and dry omce again with my friends❤️",5 stars,moderate,Mughlai restaurant
Vikrant Giradkar,"If You are in Navi Mumbai and Non-veg is what you will die for . Goget there .

Shamiana pattern of seating in a restaurant is super cool .
Order whatever and come out heavy",4 stars,moderate,Mughlai restaurant
rakesh teja,Great food always. Ambiance can be better as individual cabins. Buzzer should be kept at all cabins to call the attendents,3 stars,moderate,Mughlai restaurant
Monjeeta Baroowa,"The best place for yumm non veg food like tangdi kebabs, tandoori chicken, prawns fry.
Nice sitting arrangements",4 stars,moderate,Mughlai restaurant
