Reviewer,Review,Rating,Expense,Type
travelling,I am very happy,5 stars,expensive,Barbecue restaurant
Ruchi Baghla,Delicious food and very good quality and service,5 stars,expensive,Barbecue restaurant
ShailzaBhatia KidsLanguageNest,It is super super my all time fav food joint love to go there again and again ..i can go daily for there starters .....,5 stars,expensive,Barbecue restaurant
JOHN RAJU,Decent service. Great place for a party. You save 250 bucks per head if you check in prior to 7.30pm.,4 stars,expensive,Barbecue restaurant
debashis mitra,"As barbeque nations go, used to be a great place and concept...but since then has been taken over by pretty pathetic crowd...be ready for hearing 'happy birthday' a couple of times while having a meal...they insist on playing this on loudspeakers for anyone who is having a birthday...very annoying",3 stars,expensive,Barbecue restaurant
Rahul Gajbhiye,Once in a Lifetime experience......The Non - Veg food and fish delicacy is mind blowing...........Service is Excellent........Variety of food items is awesome.......,5 stars,expensive,Barbecue restaurant
Manoranjan Sethy,"Okay. Good for Non Vegeterian. Surprises are good.

Hidden pokicy on corporate discounts. Unacountable to comittments made customers.",3 stars,expensive,Barbecue restaurant
Anoop_Mukherjee ITS,"Nice ambience, staffs are professional, good customer service, food is also good in test. Value for money",5 stars,expensive,Barbecue restaurant
Aryan Agarwal,Loved the place and the ambiance there. The food here is also amazing.,5 stars,expensive,Barbecue restaurant
5U5HIL AG,"Well located, very good food, too good service
Fairly priced
One will like to come again n again",5 stars,expensive,Barbecue restaurant
Ananthakrishnan Sankaran,"Tasty food, great ambiance, good service.",5 stars,expensive,Barbecue restaurant
Rishab Dev Bhaskar,Lovely place to have lunch/dinner with your friends and family. Do make sure to book your table before you go to avoid any waiting,5 stars,expensive,Barbecue restaurant
Laxman Gaikwad lucky G,Good for all kind of Barbique dises and well manged test since long in this area so for hang out in evening is best time to visit this place,5 stars,expensive,Barbecue restaurant
thomas geoji,Good place if you got the appetite !! Good food and good ambience. Staff is prompt and polite.,5 stars,expensive,Barbecue restaurant
A M,Good food & very polite staff. They will kill you with serving unlimited food. 😋 …,4 stars,expensive,Barbecue restaurant
Ittehad cricket Acedmy,Delicious food. Worth it. Awesome service. Best place for gathering.,5 stars,expensive,Barbecue restaurant
Kartikeya Shetty,Starters and Desert was Quiet Good. But Main Course was not having much variety. In Starters only stomach will get full.,5 stars,expensive,Barbecue restaurant
sagar chauhan,Best place for dine in. Love the taste of starters. Specially the pineapple roasted on tandoor with spices. Awesome taste.,4 stars,expensive,Barbecue restaurant
rahul sawant,Good  food nice place great staff i gon with my family for my sister in law birthday party,5 stars,expensive,Barbecue restaurant
Praveen M,Very nice place. Great food and quantity. Excellently managed and very nice place to hang out..,4 stars,expensive,Barbecue restaurant
Vaidehi Domadia,"Very good experience
Staff is very polite and we had a really good time",5 stars,expensive,Barbecue restaurant
Sunil Nair,"Great starters....food is good, service was also excellent and hospitality by staff is great....must visit .....",5 stars,expensive,Barbecue restaurant
Pratik Jadhav,"The Service is too good as always , Staff Is always ready to complete ur need and Just in future the seating structure should be change & also the people visit  there are some time are so loud that other people get disturb  (so as my preference only want BBQ but with good crowd should visit Kurla BBQ P MARKET City )",4 stars,expensive,Barbecue restaurant
Prasun Paul,The ambience is fantastic and the service is top notch. The food has much variety.,5 stars,expensive,Barbecue restaurant
Amritanshu Singh,This place lives up to its name. Only the main dishes were less otherwise the starters were as good as any other bbq nation.,4 stars,expensive,Barbecue restaurant
Ashish Yadav,Great place you hardly eat from the buffet cause you are stuffed with barbecue if you have heavy appetite then it is a good place other wise nice hang out with family,4 stars,expensive,Barbecue restaurant
Girja Sunil,The food was quite good but i got great experiance in other branches so was quite dis-satisfied,3 stars,expensive,Barbecue restaurant
Sapna Labade,Family dinner ke liye best place h....... food quality bhi best h. Aur khana baht tasty h.. bahut accha laga...thnku..🙂 …,5 stars,expensive,Barbecue restaurant
Van N,Great food and service.,5 stars,expensive,Barbecue restaurant
Harsh Chandane,"Grt staff good ambience
Good non veg food
Veg menu limited …",3 stars,expensive,Barbecue restaurant
Ranjeeta Kaur,Very well service given. Well treated to kids. Kids enjoyed a lot playing all around. The whole staff was very behaved.,5 stars,expensive,Barbecue restaurant
Kiran B,"Good food. Nice variety. Can reduce the price tag, as this is overhyped due to brand name.",4 stars,expensive,Barbecue restaurant
Vinayak Wakchaure,Very good ambience. Great service . Tasty food. Mouth watering biryani.,5 stars,expensive,Barbecue restaurant
Ankur Mehra,Always a treat to have food at Barbeque Nation. No doubt it serves best variety in Non Veg Starters.,5 stars,expensive,Barbecue restaurant
Husen khan,"Nice Place & Very Good Food
Staff So Friendly",5 stars,expensive,Barbecue restaurant
abhishek salunke,Service was good,4 stars,expensive,Barbecue restaurant
Prakhar Saxena,Excellent service. Very friendly staff. Great food and large selection to choose from. Awesome desserts.,5 stars,expensive,Barbecue restaurant
Amandeep Baghla,Great place for buffet lovers especially non veggies..staff is very cordial and make you feel very comfortable..highly recommended..,4 stars,expensive,Barbecue restaurant
Tanmaya Computer,"Staff was nice to us but starters were very good but the main course was not up to mark
I suggest eating in a hotel",3 stars,expensive,Barbecue restaurant
Saurabh Kumar,"Good place for non veg buffet with drinks. Music is little loud. Looking for quite place, not a good option.",4 stars,expensive,Barbecue restaurant
Gaurav Surana,Perfect place to have a full dinner. Live barbeque and ambience makes everything very live. Non-veg servings makes it difficult for pure veg...,4 stars,expensive,Barbecue restaurant
Karunakaran Narasingam,"BEST place for the weekend and I have been there twice specially for partying
You can get veg non veg
Book before you go",4 stars,expensive,Barbecue restaurant
Partha Saha,Good food but becomes mundane after a couple visit as the main course can work on having some variety,3 stars,expensive,Barbecue restaurant
Mathew Aji Thomas,Very good place for taking your family and friends and enjoy the food..... Very good food both Veg and Non Veg options......,5 stars,expensive,Barbecue restaurant
Mohit gore,"Best quality food for a very reasonable price. Best starters, awesome service and a chill atmosphere !",4 stars,expensive,Barbecue restaurant
Gajanan Gore,As usual loved this place...Amazed with Staff's Hospitality ....,5 stars,expensive,Barbecue restaurant
Shaharban T A,"Awesome service and food.  Best barbeque in Navi Mumbai compared to all other Mahape, Vashi outlets.",5 stars,expensive,Barbecue restaurant
rajeev anand,Real good place to dine with never ending varieties and mouth watering devine taste of everything on table,5 stars,expensive,Barbecue restaurant
say mak,Good food no doubt but walkin guest has a wait Time suggest to book before arrival,4 stars,expensive,Barbecue restaurant
Shireen Alvi,Earlier they use to serve variety of grills now there is no variety,3 stars,expensive,Barbecue restaurant
Ankul Pratap Singh,A good place for party. BBQ always good.,5 stars,expensive,Barbecue restaurant
Nruti Joshi,"With compared to Belapur barbeque nation , ambiance and staff both are average. Verities in desert were limited than Belapur.",3 stars,expensive,Barbecue restaurant
Admin Pro,"Great food and very nice quality of the buffet, but a bit expensive for average people.",4 stars,expensive,Barbecue restaurant
ANIL HEGISTE,Perfect place to dine. Service is damn too good....will try to visit once again..,5 stars,expensive,Barbecue restaurant
Adit Minocha,You should make sure you skip your breakfast if you want to make most of coming here. I only eat 10 starters and 10 desserts and don't fill myself with rice or roti.,5 stars,expensive,Barbecue restaurant
sripriya s,Great food. Great Service!! Rajneesh/Rajesh was very courteous and attentive!!,5 stars,expensive,Barbecue restaurant
vishwas madaan,Good food. A bit expensive. Very crowded difficult to find place on weekends.,4 stars,expensive,Barbecue restaurant
Reena Singh,"Great experience....right from mouth watering food, to courteous staff and amazing ambience....making it a mind blowing experience overall !!!!!",5 stars,expensive,Barbecue restaurant
Ramit Sharma,Awesome ambience...Staff is awesome.. well trained... Very Much Professionals.. Best place to visit in area,5 stars,expensive,Barbecue restaurant
#cool concepts,"Amazing place to hangout, Humble staff and great ambience
Great support by Mr.Kamla !!",5 stars,expensive,Barbecue restaurant
Ritu Sharma,Good restaurant its abudget one i Am sure you will love the food here its delicious and sumptous,4 stars,expensive,Barbecue restaurant
Saba khan,Didnt like the marination of the chicken n prawns.. Place n ambience is good but food is nt upto the mark,3 stars,expensive,Barbecue restaurant
Deep Patil,Great Place and Great Food.,5 stars,expensive,Barbecue restaurant
Bobby Khan,Great place to enjoy BBQ and other delicacies. Nice ambience and service. Highly recommend for those who love BBQ.,5 stars,expensive,Barbecue restaurant
Asif Khan,"Full Paisa Vasool Place if you are visiting this place with your family.
Make sure you opt for Buffet.
You will love their service.",5 stars,expensive,Barbecue restaurant
rhea garg,"Just not expected from BBQ.. 😡
Found cockroach in my rice..
Seriously not expected. …",1 star,expensive,Barbecue restaurant
saquib hamdulay,Excellent service.. thank you nilesh patil (staff) and the manager.. bbq nerul,5 stars,expensive,Barbecue restaurant
Ashok Lehar,Average food and average service the only positive thing was the earnestness with which the staff was trying to do better.,3 stars,expensive,Barbecue restaurant
Balaji Iyengar,"Tasty food and excellent service. I would recommend this joint to everyone. However, the place is very expensive.",5 stars,expensive,Barbecue restaurant
Sanjeet Kashyap,Very bad service ever seen in Barbeque nation .. i will never let my friends to go in this barbeque nation.,1 star,expensive,Barbecue restaurant
Saurabh,"Simply awesome.
I love the deserts these people serve...
Variety of food..and taste is always outstanding",5 stars,expensive,Barbecue restaurant
Shirin Poonawala,BBQ had lived upto it's name. We had the Indian festival wherein we got to taste all the cuisines from kanyakumari to kashmir.,4 stars,expensive,Barbecue restaurant
Amandeep singh,Service and food was awesome. I went there with my friends so many time. Firni was awesome,4 stars,expensive,Barbecue restaurant
mudassir tandel,Do visit,4 stars,expensive,Barbecue restaurant
Uccha Shrva,It's a great place but they sometimes overdo stuff like during the mango festival they had mango Pani Puri.,4 stars,expensive,Barbecue restaurant
Prashant,Mouth watering food available here. May not be very healthy but it ok to have it once in a while. very accessible place.,4 stars,expensive,Barbecue restaurant
Sparrow,"Great service, great food! Awesome for family get togethers and for parties with friends.",5 stars,expensive,Barbecue restaurant
Ms. KDC,Good food and theme.. Pricing is bit high. Sofas need upgradation or improvement as the seats were torn..,3 stars,expensive,Barbecue restaurant
Rehan Ansari,"Service was good, Starters were at their best, desserts was awesome, but the main course was worst.",4 stars,expensive,Barbecue restaurant
Shekhar Kumbhar,Good food. Attentive servers. Nice place to visit with family and/or colleagues.,4 stars,expensive,Barbecue restaurant
Kumar Saurabh,"Staters and desert were good, but main course was a little disappointing. Ambience of the restaurant is nice and service is also upto the mark.",4 stars,expensive,Barbecue restaurant
Srikanth Panchangam,The best Place to Dine !!!! No match to the ambience! It's sone this very unique and soeacial experience with BBQ NATION every time!!!!!,5 stars,expensive,Barbecue restaurant
oindrilla mukherjee,Mind blowing service!!! praiseworthy service by Mr. Nilesh & Mr. Ahmed 👍 …,5 stars,expensive,Barbecue restaurant
Ajit Kumar Pal,Many items were there and all r very tasty . The waiters were also humorus. Enjoyed the tasty foods.,5 stars,expensive,Barbecue restaurant
Abhey Singh,"Awesome starters ,food.and great service.The staff is very friendly.Service is very fast .Loved it and would love to visit again",5 stars,expensive,Barbecue restaurant
anand behere,"Ok food, small place, not great for a big group. Is on a costly side.",3 stars,expensive,Barbecue restaurant
AsLam NaDaf,Loved the food Quality and Service 😊 …,4 stars,expensive,Barbecue restaurant
Shreya Gadre,"Food quality and variety can be improved.
Rest ambience, service, everything was good.",3 stars,expensive,Barbecue restaurant
Ankur Dutta,"One of my favorite places for sea food. The mutton is nice too..Must try the one in Nerul, Navi Mumbai",4 stars,expensive,Barbecue restaurant
yash kumar,Very amazing place to eat with family and friends....food was good,5 stars,expensive,Barbecue restaurant
ANISHA RAY,"Good comfy place, limited variety in d spread offered. Friendly n caring staff.",4 stars,expensive,Barbecue restaurant
dhira divakaran,"It was a average experience, it used to be very nice. Nothing Wow just a grill restaurant. The non veg main course was very limited.",4 stars,expensive,Barbecue restaurant
Nikunj Sawant,"Authentic food, perfect for family, friends gatherings,  parties. Varieties of veg and nonveg dishes available. Dont miss the deserts..",5 stars,expensive,Barbecue restaurant
Padmini singh (Pam),"I love going there, coz there is unlimited food, n some time half price for non Veg n Veg food..Visit once",5 stars,expensive,Barbecue restaurant
Prashant Jadhav,"Superb Experience...
Very Polite staff, well trained as well... …",5 stars,expensive,Barbecue restaurant
kirti satwani,Starters are really good.  But the food is very bad.  So are the deserts . Go there only if u love barbecue. .,3 stars,expensive,Barbecue restaurant
Gaurav Gupta,"Fantastic people and great food.
Best family time hotel book prior recommended.",5 stars,expensive,Barbecue restaurant
ameet kaur,They don't entertain walkins..  the staff at the counter kept telling its full and we don't have a table.. while we did a online booking the tables were free and booking was done easily..  how stupid is that.,1 star,expensive,Barbecue restaurant
nitin kashyap,Gr8 choise of food. Staff is very friendly. Makes you feel at home. Very crowded on weekends n holidays.,5 stars,expensive,Barbecue restaurant
Atty,Getting old and weary. They need some serious makeover,3 stars,expensive,Barbecue restaurant
Globe Wanderer,"This particular outlet is not so good. The quality have deteriorated, and the service level is also not as good as other outlets of them.",2 stars,expensive,Barbecue restaurant
Noor Bhatkar,Amazing ambience and quality food. You must definitely visit it.,5 stars,expensive,Barbecue restaurant
Sandeep Gabhale,"Good Food, Good Ambience and good serving people.
Nice experience overall",5 stars,expensive,Barbecue restaurant
Rahul Kumbhar,Good service. Good food. Though expensive for the price they serve and the environment they have.,4 stars,expensive,Barbecue restaurant
Theophilus Solomon Daniel,"Visits to barbecue nation always leave me full and satisfied! Great starters, excellent desserts and a very pleasant experience!",4 stars,expensive,Barbecue restaurant
Dr Farukh Shaikh,Best Barbeque Nation branch in Navimumbai.. Great taste..... Well Managed by the manager Ali..,5 stars,expensive,Barbecue restaurant
Shitij Kumar,Great food and ambience. The staff were very friendly and nice.,5 stars,expensive,Barbecue restaurant
Tushar Mhatre,"The food here is same as you can find on any other bbq nation.(which is awesome )
Service is also nice and ambience is ok.",4 stars,expensive,Barbecue restaurant
TEJAL KADAM,Good variety of starters and dessert. Decent main course. No complaints on service.,4 stars,expensive,Barbecue restaurant
snehal sawalkar,Food is very tasty as always and the nice experience. But they did not have live counters as other branches.,4 stars,expensive,Barbecue restaurant
Gaurav Singh,Excellent place for foodies to enjoy pleasing environment excellent staff and service.,5 stars,expensive,Barbecue restaurant
Nilesh Zodape,Most wonderful person teast us each food items. Thank you Rajnish. Guy go and ask for Rajnish he will guide you and teast you each and every item,5 stars,expensive,Barbecue restaurant
Sachin,Good dinner place. Many choices nice ambience. Needs to book in advance if crowd is big.,3 stars,expensive,Barbecue restaurant
Avishek Jha,"This place is a Mecca for food lovers. The taste buds are well ignited. Be it office parties or family outings, the experience is a memory.",5 stars,expensive,Barbecue restaurant
Didar Hossain,Quality of service and food is of the same great standard as I have experienced in BBQNations located at more prime localities.,5 stars,expensive,Barbecue restaurant
alankrit shrivastava,This place I gave been many times...I think they have to work out on their menu as the menu is always same ...the same prawns same biryani same fishes ...there has to be something new ...as of now I am bored with same taste.,2 stars,expensive,Barbecue restaurant
Bhaskar Gajula,Affordable prices wid long last buffets......live counters also great hospitality. ......always ready to go 😁😁 …,5 stars,expensive,Barbecue restaurant
Jyotsna Srivastava,Very good food and very good service.Also very kind people.,5 stars,expensive,Barbecue restaurant
akshay patil,"The food here is awesome. It is a bit on the expensive side, but you'll have a good time with your friends and family",5 stars,expensive,Barbecue restaurant
Rajiv G,"Good service, Good ambience,... Average quality starters and main course, great desserts.",3 stars,expensive,Barbecue restaurant
DEEKSHA SHARMA,Amazing place. Nice ambience. Good food and friendly staff,5 stars,expensive,Barbecue restaurant
v girinarayanan,Good place and excellent experience guaranteed . Best place for family get-together and bday celebration,5 stars,expensive,Barbecue restaurant
Pooja Parekh,Best place to have a non veg or even a veg buffet with family and friends...it's the best outlet among all other BBQ nation,5 stars,expensive,Barbecue restaurant
Anand Shetye,Its a treat to  have food here. The non-veg food served here is excellent even deserts are perfect. I would advice you to book the table in advance.,4 stars,expensive,Barbecue restaurant
Swagat Jagirdar,Deepak gave excellent service very happy with his postive attitude 🥳🥳🥳 …,5 stars,expensive,Barbecue restaurant
Alphadog Rahul,"Amazing place and hospitality.
Good food
Had an amazing time.",5 stars,expensive,Barbecue restaurant
nitin thorat,Good food quality,4 stars,expensive,Barbecue restaurant
Ashutosh Negi,Great starters and main course but disappointing desserts. Service is good and ambience is nice too.,3 stars,expensive,Barbecue restaurant
JOMY YOHANNAN,You can stuff yourself with mouth watering veg and non-veg..  The starters are good.. Huge variety of dishes..,5 stars,expensive,Barbecue restaurant
Virendra Gurav,"Great barbecued food. Quite expensive. Charges per head vary on weekends and weekdays, in d noon and in d night. Per person costs from 700 to 1100.",4 stars,expensive,Barbecue restaurant
Susheel Verma,Nice testy and lots of Verity food served here also desert served. Too memy option in veg as well non-veg recommend to everyone.,5 stars,expensive,Barbecue restaurant
prateek Agarwal,It was great experience. Good food and lot of variety both veg and non veg.,5 stars,expensive,Barbecue restaurant
reshmi nair,Nice barbequed food and ambience very comfortable for frnds and family... But not  for frequent visits as the barbequed food options will be same...,5 stars,expensive,Barbecue restaurant
Bapin Gantayat,Superb place to eat. Lots of variety in buffet. Great service...All good,5 stars,expensive,Barbecue restaurant
Isa Shaikh,Never seen a better service and cooperation.,5 stars,expensive,Barbecue restaurant
Abhi Das Android,Awesome & tasty starters. Main course is ok. Desserts are also taste awesome.,5 stars,expensive,Barbecue restaurant
Madhusudhan Reddy,Very good,4 stars,expensive,Barbecue restaurant
Enfield Life,"Good place to hang out with friends and family, food is good and they can cook food of your choice on demand",4 stars,expensive,Barbecue restaurant
Shantanu Rastogi,One of my favorite restaurant. The food was excellent and so was the service. It was just fantastic !!!!!,4 stars,expensive,Barbecue restaurant
Supreeta Sen,"Great food, great service, really nice ambience.
Would like to visit again..",5 stars,expensive,Barbecue restaurant
Mohamad-Ali Badar,Have a appetite? Go test it here. Good starters and customer service. slightly on the expensive side. But still worth it.,5 stars,expensive,Barbecue restaurant
Akanksha Nimish Chauhan,Lovely and courteous staff. I came with my family of 8 and celebrated my husband's birthday!,5 stars,expensive,Barbecue restaurant
Kriti Mankotia,"We Always enjoy there, good food, best thing, they don't rush you",4 stars,expensive,Barbecue restaurant
Suhail Wangde,Amazing ambience..excellent service..and really really good food..always looking forward for it.,5 stars,expensive,Barbecue restaurant
Abhilash Ware,"Good place to hangout with family n friends, BBQ food is good ,
Excellent service and staff though costly.",3 stars,expensive,Barbecue restaurant
Jayesh Bhoir,Excellent place food quality is too good.,5 stars,expensive,Barbecue restaurant
Biplab Mukherjee,I love the concept of Barbeque nation but they don't have any taste .... just volume to stuff your stomach,3 stars,expensive,Barbecue restaurant
Evangeline Thompson,Good starters. Entire meal worth the money. Good place to go with the family and friends,5 stars,expensive,Barbecue restaurant
Mugdha Bhosekar,"Very smoky place and no verity for vegetarians,  total waste of money and not value to money for vegetarians. Non vegetarians can enjoy though.",1 star,expensive,Barbecue restaurant
Javed Aman,Best place for meat lovers. Unlimited starters and a great range for a buffet. Amazing value for money,5 stars,expensive,Barbecue restaurant
Saba Shaikh,"I went with group of high School kids and apart from amazing food,they also gave a guided kitchen tour..kids loved the experience",4 stars,expensive,Barbecue restaurant
Allen Lasrado,"Friendly staff, Excellent service...",5 stars,expensive,Barbecue restaurant
Vishnu Nambiar,"Ambience is great, food service is also great, all in all good place to hang out with friends and family",4 stars,expensive,Barbecue restaurant
kishor sonawane,"Very nice , and staff is polite, and sincere, food very good, hotel best",5 stars,expensive,Barbecue restaurant
ROHIT KENI,Best BBQ branch in navi mumbai,5 stars,expensive,Barbecue restaurant
ramaa prabhu,Great food!!! Best for family / friends get togethers party etc!! 😊👍🏻 …,5 stars,expensive,Barbecue restaurant
Ojas Agrawal,"Very nice food
Best for foodies
Diff to get a seat on the spot
A bit costly for those who don't eat much",5 stars,expensive,Barbecue restaurant
ashwini sheth,Nice ambience..hospitality is very good. Food was good and had good time with family.😃 …,4 stars,expensive,Barbecue restaurant
Boban C.Thomas,Good ambience ..chutney not up to the mark..1000 RS per head buffet is little costly.,4 stars,expensive,Barbecue restaurant
rajan gulati,"Good Service.
Too Loud Music
Deserts not up to the Mark
Need to Improve on Food Quality",3 stars,expensive,Barbecue restaurant
Pradeep Mondal,Nice ambiance.. tasty food... good and well trained staff....,4 stars,expensive,Barbecue restaurant
Parth Pachpute,"Its a nice place to eat, staff is helpful and the buffet charges are also valuable",5 stars,expensive,Barbecue restaurant
Hitesh Kaniska,Fish starters are just amazing along with Kebab's. In main course you have to try crabs.,5 stars,expensive,Barbecue restaurant
Shahid Momin,Nice place but food variety is less for non veg.,4 stars,expensive,Barbecue restaurant
SriHarsha A,"Good Ambience, Tasty food, Staff were very polite and courteous.",4 stars,expensive,Barbecue restaurant
abel john,"Good place for one time, earlier Fish festival was great but now not so much",4 stars,expensive,Barbecue restaurant
Nadim Shaikh,Very congested sitting place... To much crowded....Food quality also not at par.,1 star,expensive,Barbecue restaurant
Amarita Singh,"The starters and dessert quality was below their brand standard...
Ambience is average!",3 stars,expensive,Barbecue restaurant
Ashish Lakhlani,Nice ambiance and good food for sure,4 stars,expensive,Barbecue restaurant
Vrushali Patil,Nice place..im loving it,5 stars,expensive,Barbecue restaurant
Devansh Gupta,Nice place for food specially starters and deserts. If you are nonveg then sort of blessing,3 stars,expensive,Barbecue restaurant
