Reviewer,Review,Rating,Expense,Type
Sandesh Patil,"I enjoyed my last night dinner with BBQ Nerul lovely staff , they're really trying their best to give you good food quality and very  good service
I would like to specially thank biswajit and lalu Oraon from the service team
Thank you 👍 …",5 stars,expensive,Barbecue restaurant
Kaval Kaur,"Barbeque nation - Pioneers in the concept of cooking half cooked barbecue it on your table which excites a lot.Starter are really good and filling, you have good options in main course and lots of desserts. It's better to book in advance and go early so that you have ample time to enjoy",5 stars,expensive,Barbecue restaurant
Salman Aslam Khan (Salman khan),"Yesterday night was very mesmerising for us because the atmosphere we have experienced over here was so amazing. A place full of happy crowd including children , parents, Office people they all having the same vibe as we did. …",5 stars,expensive,Barbecue restaurant
Rohit M,"Probably one of the most ordinary Barbeque nations I have visited so far.The staff is really nice but the food is pretty ordinary, their whole focus was to get get good reviews, if half of it was aligned to preparing good food they would …",3 stars,expensive,Barbecue restaurant
akash sharma,"Had been tonight for the birthday celebration for my daughter. The food is on the spicier side and can can be reduced.
Starters has a good variety and our attendent Mr. Deepak was a great help in …",4 stars,expensive,Barbecue restaurant
Aniket Ankam,Amazing place to have an unlimited buffet where you can find so many veg and non-veg options. …,4 stars,expensive,Barbecue restaurant
SHAHID KHAN,Last night I visited Barbeque nation nerul branch abve HDFC BANK with my wife for my birthday dinner this was my bestest decision that i have taken because the food was soo delicious and yummy and part from food the staff is too friendly …,5 stars,expensive,Barbecue restaurant
Juveria mohdnehlat,"I have recently visited here, I must say amazing food with so many varieties to try and a great ambience. The best part is the staff hospitality is amazing here, i actually wanted to pray, so the manager here helped me get the extra space cleaned up they really go extra mile for customer service really commendable ❤️",5 stars,expensive,Barbecue restaurant
Gautam Kher (gauti),"Great to have dinner with family or loved ones.
Great and tasty starters
You will find non alcoholic and alcoholic beverages served. …",4 stars,expensive,Barbecue restaurant
Rohit Malabade,Good family place to have food.. staff is amazing and helpful and food is good taste wise,4 stars,expensive,Barbecue restaurant
Sumit Chilvante,Recently I visited here with my family. The ambience is spacious here and have large seating area. The staff here is so polite and friendly. …,5 stars,expensive,Barbecue restaurant
Mayura Jain,"Recently I visited Barbeque nation. Must say it's really amazing place to hangout with friends and family. Good ambience with good food. I had buffet there. So many varieties in buffet.its unlimited. Had a so many varieties of Starters, …",5 stars,expensive,Barbecue restaurant
Dr Bushra,Had a perfect lunch at Barbeque nation Nerul outlet . It was a great time here with our table manager dipak . They serve varieties of live Barbeque veg and non veg fully unlimited and even you can customize your own bbq according to your …,5 stars,expensive,Barbecue restaurant
UTKARSHA PATIL,"Amazing experience and great service.
Loved the live grill counter. They have outdoor seating as well. The best part is they have introduced new options in the main course now. …",5 stars,expensive,Barbecue restaurant
Sanjay K Raut,"Barbecue Nation is not the place for those on a diet, but a paradise for non-vegetarian food enthusiasts. Its business concept is impressive, though it can be a challenge to find a seat during weekends. It's a lively and fun-filled destination.",5 stars,expensive,Barbecue restaurant
Pranav Dethe,"Barbeque nation, Nerul :

If you want to have some lipsmacking barbeque food and that for unlimited then …",5 stars,expensive,Barbecue restaurant
RCD thefoodie,"Yes yes i know barbeque nation or as it is loving addressed as ""BBN"" surely does not needs any introduction when it comes to some of the most amazing dishes under one roof. …",5 stars,expensive,Barbecue restaurant
Ayesha Shaikh,"I visited first time and really enjoyed the food.... Service was excellent, staff is friendly and helpful enjoyed my birthday with my partner... Atmosphere is also very good.",5 stars,expensive,Barbecue restaurant
Prachi Ghadge,"Lovely experience. You are welcomed very nicely. They describe themselves,The system and everything. And help you in every kind. Atmosphere is lively. Quality of food is great. They make changes according to you needs. They won't give any …",4 stars,expensive,Barbecue restaurant
sanjeev harikant,This was my 5th time visit to Nerul Barbeque Nation. If you are booking via app try to search for any discount. Food is very good as well as Service.  Mr.Patil was very good. …,4 stars,expensive,Barbecue restaurant
gaurav gunjan,"A very good dining place in neighborhood.
Great hospitality, specially Mr. Rajpoot was great host.
Parking is available outside. …",5 stars,expensive,Barbecue restaurant
ΛПIKΣƬ,Everything is almost perfect here. The food is awesome and it's unlimited no complaints at all. Ambiance is superb. I was there on dry day so I missed my free beer. Every BBQ Nation I visited till now has this one flaw. They serve …,4 stars,expensive,Barbecue restaurant
Arjit Raj,"Great Food. Great Staff. Poor ventilation. Too loudy.

Good part: As usual the food and staff was great. Fresh, hygienic food, with …",3 stars,expensive,Barbecue restaurant
Gauri Jagtap,"Best place for Unlimited foods & drinks, the ambience of place was great. They have variety of options available in Starters, main course and desserts.Also they have the live grill counter. …",5 stars,expensive,Barbecue restaurant
Dipesh Pawar,"Very nice service and food, staff is very polite and helpful especially kamlakar, always ask if need anything or any customisation in food",5 stars,expensive,Barbecue restaurant
Deepak Rajput,The food was fantastic- from starters to main course to desserts... and they also offered complimentary mocktails. …,5 stars,expensive,Barbecue restaurant
Rohan Hegde,"Barbeque nation is heven for foodies
They have all cusiens under one roof food is amazing u'll love the food and they will even custamize food according to your preference which is always …",4 stars,expensive,Barbecue restaurant
D N J,Extremely bad experience. Service is very lethargic. They are more interested in serving what they want rather then what the guest orders. Specially vegetarians are taken for a ride. Food preparation is pathetic with lots of salt in …,1 star,expensive,Barbecue restaurant
Pranit Pawar,Barbeque nation is truly a gem when it comes to live grills and buffet. There pleasing service and drooling taste of spices is what makes you visit again n again. The nerul outlet is perfect for large family/friends crowd having ample …,5 stars,expensive,Barbecue restaurant
poonam patil,The atmosphere was such like everyone was celebrating there occasion everyone was hungry and many sing a song and for birthday there was a special music by barbeque nation . Deepak was friendly and was asking us food to bring we really liked it.,5 stars,expensive,Barbecue restaurant
Saket Suman,"As always Barbeque Nation never disappoints. Went early to avail early bird discounts, but by 8 pm it was full. Service was excellent, server Veer Rajput was exceptionally good in his job. All the items served on the table were too good. …",5 stars,expensive,Barbecue restaurant
Pallav Malhotra,"Best in class. Amazing place to have buffet. BBQ nation is know for its grill and kababs. Apart from that, the hidden Gem and underated thing is the dessert at this place. One must try the desserts its amazing. Great service and very humble and professional staff. Great ambiance. Great place to hangout with friends and family.",5 stars,expensive,Barbecue restaurant
Shekhar Birari,Very Very Dissatisfied & Disappointed by Staff at  Nerul & Mahape ( outlet closed)..They not allowed me for Dine in inspite of 30-40 Clients were there around 10.45 pm.Infact timing is upto 11.00 pm..Manager & his assistant not cooperative & deliberately refused my HDFC vouchers ..Send me take a way room..it was very dirty..,1 star,expensive,Barbecue restaurant
Alfred Fernandes,"Always a great place to meet with family and friends, the food is delicious and the service is excellent, make sure to come with and empty stomach as there is a lot of variety of food to taste and don’t forget the grill stay hot in the middle of the table until you had enough, try the kulfis to end the meal.",5 stars,expensive,Barbecue restaurant
jojo,"Concept of BBQ was gathering momentum with need of the time with success giving advantages to both  guests and hosts. Having  unlimited  free  selections, with variety menu,  enriching feel at home  environment according to our taste and …",4 stars,expensive,Barbecue restaurant
Dharmadas Giri,"We are regular visiting BN for dining however, we recently found that the BN in Belapur and Nerul not up to the mark. Live counters has been stopped. Food quality is also not same as earlier. They need to pay attention towards both quality and service.",3 stars,expensive,Barbecue restaurant
gopal devadiga,"Best place , good quality of food with reasonable prices and the important part is the best service provided by the staff.",5 stars,expensive,Barbecue restaurant
Vinod Vinayak Bhosale,"Awesome experience, awesome taste and lunch items. Good ambience and very much polite and best staff. any order will be served quickly.
Barbeque is the best and still waiting for ""Rara Gosht"" to appear on menu again. …",5 stars,expensive,Barbecue restaurant
DR PRATIK TANK,"I visited on my birthday. I loved it ❤️. Lots of choices. And loved it's service..I suggest everyone
Delicious veg and non veg food offered with unlimited self service. Nicely …",5 stars,expensive,Barbecue restaurant
Suhail Barmare (Xehr),"Great Place ...GREAT TASTE!!!! FOOD WAS AWESOME ....SO WAS THE FAST SERVICE......!!! WOULD REALLY LOVE TO VISIT AGAIN!
PERKS …",5 stars,expensive,Barbecue restaurant
Samah Rumani,I am very disappointed by the way bbq turned out the way it was in the past it is not up to that level too.. I was so excited to celebrate my parents anniversary but alas nor me not my parents liked it..Prawns on bbq was raw not one not two …,2 stars,expensive,Barbecue restaurant
Imran Pathan,The place is situated on the first floor. They have 2 sections indoor and outdoor. Both are nice. Good place for a get together and throwing parties. We were around 40 who visited this place and none of us had to face any issues with the …,5 stars,expensive,Barbecue restaurant
Amit Bond,"Visited on friday for family Lunch.
Barbecued starters are sumptuous delicious and unlimited. I asked for some changes the marination and it was done ✔. The manager made the chef Visit our table …",4 stars,expensive,Barbecue restaurant
Akash Gaikwad,Yesterday i visited here with my family for an occasion of my cousins birthday. This place is very good with ample seating available. Also this place is total hygiene. …,5 stars,expensive,Barbecue restaurant
Javed Dange,"Was very pleasant atmosphere, our table was been looked after efficiently ,special thanks to Mr Deepak Ingale. Keep up the good work and thanks for service.",5 stars,expensive,Barbecue restaurant
prashant pawar,"Great food, atmosphere & service by staff. Captain Lalu & staff kamlakar doing good job thanks for making my daughter birthday very special.",5 stars,expensive,Barbecue restaurant
Kimberly Pereira,Good food and ambience. And been for the fish food festival. Had a good serving of both veg and non veg as well as some amazing desserts. Good value for money.,4 stars,expensive,Barbecue restaurant
Dinesh punjabi,"Its my review on Barbeque Nation nerul
Its bang on the palm beach road so very easy to reach very convenient location
It serves buffet veg and non-veg both have a amazing variety and great spread …",5 stars,expensive,Barbecue restaurant
Vinod Sable,"Very nice place, service also good. It's a place where non-vegiterian would love to be.  Variety of starters, veg and non-veg both.  Main course also you will get number of varieties.  For sweet dish there are cakes, moose, gulab jamun, ice …",5 stars,expensive,Barbecue restaurant
Nikhil Shah,"The place as the name says. Is truly an barbeque heaven. Highly recommend that you go with a big group. Because the greater the number. Greater the fun. Food is amazing, and if you visit at night try having a seat in the outside seating …",4 stars,expensive,Barbecue restaurant
Priyanka Tribhuvan,"Food, atmosphere and service was very good...loved it 👍💗& Staff Mr Lalu oraon and Mr biswajit has given best hospitality treatment …",4 stars,expensive,Barbecue restaurant
mandar omale,"Chicken starters were ok, kebab & prawns was great, dessert are awesome",4 stars,expensive,Barbecue restaurant
Shubham Pise,"I used to go there, it's fantastic place with team",5 stars,expensive,Barbecue restaurant
Shashank Rane,Ambiance very nice. Food also has variety and it is tasty. Good to hang out with family and friends. Place good to celebrate your birthday and anniversary. They offer cake and get involved in your celebration. They do have various franchise. Just checkout your nearest location to hang out. Keep Enjoying.,4 stars,expensive,Barbecue restaurant
manoj madhavan,"Excellent! Awesome !! As always Barbeque Nation is the fun  place to go for all your celebrations. A treat you want to give, a Birthday treat u wish to celebrate, a surprizze Anniversary party you wanna throw.... Coz.. they Spoil you …",4 stars,expensive,Barbecue restaurant
Koustubh Gokhale,This has always been the most favoured and loved eatery for barbecue. All dishes served at entrees were really mouthwatering. Prawns and fish were sufficiently marinated and prepared to perfection. The dishes served during the main course …,5 stars,expensive,Barbecue restaurant
Abhishek Shrivastava,"Terrible experience. AC isn't working. Cockroach on the table, food isn't served properly specially for vegetarians. Pathetic service, unmanageable ecosystem. Spoiled the evening for agroup dinner of 12 people. My last visit to any barbeque nation outlet ever",1 star,expensive,Barbecue restaurant
Sneha Dhotre,Service is good. taste was awesome. Staff is very helpful special thanks for mr golu and kamlakar. There approach is very good towards the customers.,5 stars,expensive,Barbecue restaurant
karan basani,"One of my best experience visiting the place! Food was amazing and the ambiance too, even the staff was too kind in their service.",5 stars,expensive,Barbecue restaurant
PRATIK CHANDRAKANT SAWANT,Fews places are there in Navi Mumbai that are worth going. This is one of them. Ambience here is good. The quality of food served here is at par. Prices are reasonably good. Desert is just awesome.,5 stars,expensive,Barbecue restaurant
Ratnadeep Katke,"This is The best franchise of barbecue nation in Navi Mumbai . Nice surrounding and crowd. Food quality is also nice other than barbecue nation. Located at prime location, palm beach road Nerul",5 stars,expensive,Barbecue restaurant
Pratiksha Bera,"BBQ Nation is mainly known for the services they provide which is amazing, love their live grill concept.
I visited the outlet during their Jhoom Barbeque Jhoom Fest, they have kept a …",5 stars,expensive,Barbecue restaurant
rohan bhoir,"1st we are regular visiter / foodies of barbaque's, dhaba's, restaurant's..

""DO NOT FALL IN TRAP OF THESE 4-5 STAR RATINGS"" …",1 star,expensive,Barbecue restaurant
aqib kalandar,"Dinning experience  was superb
Overall service  experience  is also pretty  good
Food taste is excellent …",5 stars,expensive,Barbecue restaurant
Mahasweta Majumder,"Food was excellent. The hospitality was great, servers were extremely polite and well behaved. Ambience was calm and the service was fast as well. The person who served us was Nilesh and he took really good care of us. It was a really good experience overall. Loved it.",5 stars,expensive,Barbecue restaurant
Radhika Subramanian,Good food and loved the service . Loved the way all the cstrs too joined in for celebrating everyone's birthday..would indeed recommend this place for a good time with family n friends,5 stars,expensive,Barbecue restaurant
SEEMA JAISWAL,"Had been there for celebrating my marriage anniversary.
Good for starter specially for Non veg lovers.",4 stars,expensive,Barbecue restaurant
Jayaram Kandula,"Undoubtedly, the best option with very delicious starters, kebabs on the grill, main course and mouth watering desserts. Non-vegetarians definitely have lot more options but vegetarians won't be disappointed. I'm a vegetarian and regularly …",5 stars,expensive,Barbecue restaurant
Pranav Degwekar,I visited barbeque nation a day ago well i have been here before but the craving for the live grill and starters pulled me back to this place a magical place with all flavour in just right place well i'm a vegetarian still this place is the …,5 stars,expensive,Barbecue restaurant
kiran bhoir,When I heard of unlimited Buffett I just get one name in my mind that is Barbeque nation.. staff are very friendly food is yummy. for me basa fish is life 😍 & deserts are lovely.. One last thing barbeque Waiters don't take tip 😄 …,4 stars,expensive,Barbecue restaurant
ashutosh singh,Amazing food and excellent staff. I celebrated my wife's  birthday at Barbeque Nation- Nerul and that was awesome,5 stars,expensive,Barbecue restaurant
Jasmin John,"Delicious good with great arrangements.Other than that food was delicious, atmosphere was nice. The quality and taste of food was very good. Do need to try sweet and spicy pineapple served in starters.We got mushroom,corns, fish, chicken, …",5 stars,expensive,Barbecue restaurant
Tanvi Patil,"I love their food they made my birthday special ❤2020

Added some more pics celebrated my birthday in 2021",5 stars,expensive,Barbecue restaurant
Aniket Mane,"This is the finest BBQ nation outlet around with awesome staffs and manager and great food. When we arrived and started the meal, the manager approached and said ""you're my guest and not customer❤️"" and he really meant it. Along with the …",5 stars,expensive,Barbecue restaurant
Mohit Ahuja,"Good place for college crowd. It's totally worth for Non-vegetarians!♥️ Starters and desserts are the best served here.
Tip: Free cake if there's someone's birthday in your group!✌️",4 stars,expensive,Barbecue restaurant
Grissel Priyanka Mathias,If you're extra hungry this is the best place to eat. Amazing starters and desserts and meal. They even had a spin the wheel game. The waiters are so helpful and they get the starters on time. A best place for parties,5 stars,expensive,Barbecue restaurant
369 Miless,Incredible Service by Nilesh Pandey. He was very good and very polite. His Nature was also very good. Very good food and atmosphere as well. Food was very good and atmosphere was also pleasant.,5 stars,expensive,Barbecue restaurant
BHUSHAN BOUDHANKAR,"Nothing much to say about this place. Its heaven for foodies. If u want to eat and eat and eat. This is the place for u.
Mainly for the non vegetarian people. …",5 stars,expensive,Barbecue restaurant
mukesh kumar,Great food good ambience and staters are great except prawns with I did not find satisfactory dessarts r just outstanding,4 stars,expensive,Barbecue restaurant
Pawan Wagaskar,"Ambiance is good, staff is really polite and helpful, the number of dishes they provide is just huge and neverending the only thing bothered me was the starters which the place is known for, the taste was not up to the mark was a bit …",3 stars,expensive,Barbecue restaurant
Shanaya Phillips,"Itz an amazing place the staff, food , quality food is damn good must try it!!",5 stars,expensive,Barbecue restaurant
Surajit Panja,Excellent with lots of varieties and very friendly staff. Would definitely recommend,5 stars,expensive,Barbecue restaurant
Pushpraj Singh,It was my first visit in Barbeque nation at Nerul. I would like to thanks the staffs of barbeque for the wonderful experience of foods and good gesture. The taste of food is too amazing. Since it was my first visit so they offer me a small cake to welcome. I like the most. Soon i will visit again with my family.,5 stars,expensive,Barbecue restaurant
Tanu Singh,Superb...the food was awesome and the service was fantastic... enjoyed every moment being there,5 stars,expensive,Barbecue restaurant
Swagata Deshpande,"If you are having very high expectations from this place, then it may put you down. Because food was average and don't have that much of variety in starters, though managers tried their best to give us variety of food by experimenting …",3 stars,expensive,Barbecue restaurant
Kiran Phanse,"इधर खाली पेट ही जाना 😉, ठेन you njoy much more...Park your car opposite side of the road....Fry corn superb.. …",5 stars,expensive,Barbecue restaurant
Arshad Khan,"Good Quality Food, Well behaved staff, Awesome Service. Unlimited Food in 700-800 rs for Single person. Good ambience.",5 stars,expensive,Barbecue restaurant
Anil Jain,"Overall, I had a mixed experience during my visit.

One thing that stood out to me was the variety of starters on offer. It was …",3 stars,expensive,Barbecue restaurant
Vinayak Kadam,"Food is very great, veg & non veg both, fresh meal, starters are awesome, drink, main course, desserts is mouthwatering. They don't accept tip is their speciality. Do visit.",5 stars,expensive,Barbecue restaurant
Shailendra Sharma,"Hii all,
Recently visited the barbeque nation, Nerul the visit to the barbeque nation was for the first time and it was the day when they were having mango day.... …",3 stars,expensive,Barbecue restaurant
Prasad Pol,Bestest outlet of BBQ ever... We frequently goes there to dine in...food is simply awesome including veg and nonveg... Super quality food served in main course...live grill items are available in different types... Spiciness is adjusted …,5 stars,expensive,Barbecue restaurant
Suyesha Dongre,"Ordered veg Briyani  and butter chicken rice bowl
From Swiggy
Excellent packing but taste is compromised …",3 stars,expensive,Barbecue restaurant
Aiswarya Sukumar,You need a prebooking. It’s quite crowdy especially in weekends. Food was good and there is great choice options in starters as well as desserts. Service was good.,4 stars,expensive,Barbecue restaurant
Siddhesh Kadam,This restaurant for vegetarian people seriously worthless & purely waste of money...chat is seriously horrible taste 🤮.....service also very bad & very very slow ....I really unhappy from this restaurant...I am not taking also this 1 star …,1 star,expensive,Barbecue restaurant
Paras Tomar,"Starters- 8/10
Main course- 6/10
Deserts- 8/10 …",3 stars,expensive,Barbecue restaurant
Amol Shinde (AmolRalegan),"This 5star,s for table attendant B. RAJPUT..
Good food quality..
I like the most is pineapple khatta mitha... delicious...",5 stars,expensive,Barbecue restaurant
Ravi Raj,A place to for all you can eat. Great combination and variety of  starter they serve. Tastes yummy . Buffet dinner also present. Anything you eat will cost you per head. Drinks also available which will count seperately.,5 stars,expensive,Barbecue restaurant
Sarika Patil,"Staff was very good, humble...made us feel very special",5 stars,expensive,Barbecue restaurant
Firdous Sayed,"I found cockroach on the table when I about sit on that table,,, Please look into the hygiene part which is foremost important for any restaurant.",1 star,expensive,Barbecue restaurant
JAI DOI,Very child friendly. Has lot of options to eat. Starters were great.,5 stars,expensive,Barbecue restaurant
Lavanya Samanta,The starters are really good. You just want to have more but keep space for the main course and desserts. I love this place,5 stars,expensive,Barbecue restaurant
rashmi duraphe,Amazing birthday dinner i have ever had 😊 great and best service given by Biswajit. He was so attentive and extremely helpful in his service. …,5 stars,expensive,Barbecue restaurant
Vipul P,"Barbecue nation is best if you are a real foodie with good appetite.
Her you can get chicken, fish, mutton as well as variety of veg barbecue items served on the table. Each table has its own barbecue grill so you can grill as …",5 stars,expensive,Barbecue restaurant
Zahir Mukaddam,Excellent service. Tasty food. Good variety.,5 stars,expensive,Barbecue restaurant
NITESH GUPTA,"Food was good .... service was great.
Only thing i did not like was waiting for 25 mins even after reserving our table 4 hrs back.the person in charge of table told me that u have to wait even after …",3 stars,expensive,Barbecue restaurant
Apurva Wadekar,Barbeques Nation serves Barbequed Food both NonVeg & Veg. They have Buffet System - Unlimited Started + Main Course + Dessert (Which is inclusive of Pastry+kulfi+ pheerni + Gulab Jamun) & Fruit Salad Too. Good Hygeine as Veg Food is served …,5 stars,expensive,Barbecue restaurant
Alefiya,"Nice place for barbeque lovers, amazing services and with every penny.. Delicious food, great menus...",4 stars,expensive,Barbecue restaurant
Sagar Shidruk,Very Very Good place for celebration as well as eating out. Food quality is awesome ☺☺☺,5 stars,expensive,Barbecue restaurant
