Reviewer,Review,Rating,Expense,Type
Raghav Bhide,"Great place to have Asian food in Chembur.

Ambience is good and comfortable. …",4 stars,expensive,Chinese restaurant
Aman J,"Last night, we dined at China Bistro, where the dim and romantic ambiance set the mood. Our culinary choices included the delightful Crunchy Avocado Roll Sushi and the flavorful Chilli Garlic Noodles, both of which were outstanding. …",4 stars,expensive,Chinese restaurant
Manali Chavan,A good place if you are a fan of Chinese cuisine. All the items on their menu are just authentic. Good and prompt service by the staff. Their buffet has a wide range of options to choose from in both veg and non veg.,5 stars,expensive,Chinese restaurant
Epicure Duo,"beautiful ambience.

I ordered …",5 stars,expensive,Chinese restaurant
Alinio Mascarenhas,Nice place for go for a quiet dinner. They have valet parking so that’s not an issue. Large capacity so you’re sure to get a table. The food was really nice. Good range. Little on the pricier side but delicious and worth it. Service was …,4 stars,expensive,Chinese restaurant
Reema Mukhopadhyay,"Super yummy and healthy food. You can try anything. I have visited 5 times total as of now. My most visited restaurant. Service is a bit slow , else everything fine .. You can celebrate birthday or any occasion here . Must try Buddha's fu desert.",4 stars,expensive,Chinese restaurant
Niv Shetye,"China Bistro, located in Chembur, specializes in Asian cuisine. Our decision to try it was random, guided by Zomato reviews. Opting for the buffet at ₹950/- per head, exclusive of taxes, we were presented with an array of veg and non-veg …",3 stars,expensive,Chinese restaurant
GAURAV BHARADWAJ,"It was bad as we saw cockroaches running around where the buffet was served. Very unhygienic. Not going to this place for sure. They are charging a premium amount for food. But no hygiene kept. What if anyone fals sick after eating this food. I can only imagine what's the situation of kitchen, God knows.",1 star,expensive,Chinese restaurant
Sujata Sriram,"A great place for a group to get together and share a meal.
The buffet spread is substantial. Starters are served at the table, and the variety is such that you can fill up on soup and starters and not want to eat much …",4 stars,expensive,Chinese restaurant
Madhur Dsilva,We really enjoyed the Afternoon buffet. The straight away dive into the  seafood starters were the highlight of our   experience ..  . The kids relished it well ....total bliss. …,5 stars,expensive,Chinese restaurant
hinal madhav jadav,"Sushi is just a wow.. ,
And pad thai is also 👌
Overall great experience 😊 …",5 stars,expensive,Chinese restaurant
The Review House,"Firstly the ambience is very nice and soothing.
There is a lot of place for sitting
There are a lot of varieties in the menu. …",5 stars,expensive,Chinese restaurant
Dr.Mayuri Upmanyu,"The best place to take dates / friends for a meal.

Tasty food, good vibes, great services.. …",5 stars,expensive,Chinese restaurant
Richa Gautam,"I visited China Bistro with my family. This is a great place to enjoy Pan-Asian food. The menu is not limited to Chinese only. It covers the best of Vietnam, Singapore, Thailand, Malaysia, Indonesia, Hawaii, Japan, Korea etc. …",5 stars,expensive,Chinese restaurant
Vighnesh Joshi,"It was truly an amazing experience visiting China Bistro - Chembur, located just some distance before Telecom Factory.
I went to have dinner and we ordered Crispy Spicy Avacado Roll, South Asian …",4 stars,expensive,Chinese restaurant
Prachi Shah,Considering the 4.2 star rating we visited. They didn’t know how to make a sangria. The first round had almost nil wine. The second round which came after 15 min one had ice in it one was room temperature. When reported to the server he …,1 star,expensive,Chinese restaurant
Rimita D,Being a chinese lover so was looking forward to visit China Bistro. The outlet is somewhat far from Chembur station. An auto ride would be convenient. The ambience is so soothing along with a colourful wall art in buffet section. Unlimited …,5 stars,expensive,Chinese restaurant
Sandeep Motilal,"Had gone for lunch buffet on a Saturday the place was packed with people and the ambience was good.
Service could have been better asit was about slow but was nice, …",4 stars,expensive,Chinese restaurant
Kalpesh Bhole,"It was a great experience. The ambience and the staff are really great.
The food, might look expensive, but worth the cost. Some of the best cuisine I've had in a long time. …",5 stars,expensive,Chinese restaurant
Debashis,"It was a lovely evening i spent over here.
You will definitely enjoy Pan asian food.
Ambience is nice. One thing i must say that if you have lots of time then you …",5 stars,expensive,Chinese restaurant
Sunny Gurnani,China Bistro located in oasis premises at Chembur Deonar highway is a fabulous place serving authentic Chinese food from years now. It has been a first choice for most of family dinners and get together for all Chinese food lovers. I …,5 stars,expensive,Chinese restaurant
Nikunj,"Ambience: 5/5
Location: 3/5 (Besides India Bistro)
Service: 4.8/5 …",5 stars,expensive,Chinese restaurant
AfriDi MohAmeD,"Best Ambience and Nice place for the family lunch the taste was very nice.
….
Buffet menu was short and simple, Which makes us to enjoy the meal nicely. …",4 stars,expensive,Chinese restaurant
tejashree bhoir,"The food was good. I tried their stone bowls and it was tasty. But I felt that their service was lacking a bit, they were mainly focused on buffet people and provided our drinks near the end of our meals.",3 stars,expensive,Chinese restaurant
RAJARSHI BHAWAL,Really good food. Quick service. Enjoyed fully. Some authentic Chinese dishes were there. If you can't figure out which of the dishes to try then go for pan fried fish or ask for quick guide.,4 stars,expensive,Chinese restaurant
tony chacko,After seeing the many reviews we Had visited the restaurant on 16th Oct 2022 with great expectation. We were 6 people and all were total disappointed with the Buffet Lunch. The food tasted Bland.for Rs880 for Non veg buffet the varies was …,2 stars,expensive,Chinese restaurant
Gunjan Kumar Singh,Complete Chinese package 🍜 Amazing Service..Staff was fast. Everything was served hot and fresh..Food was really good..starters had great variety..even the vegetarian food was delicious. Place is really clean.If you're looking for a good …,5 stars,expensive,Chinese restaurant
Adrian M,"Top 3 restaurants in Chembur, food is great. Ambience is good, their cutlery is also quite nice. This is probably the restaurant I go to the most in Chembur. …",4 stars,expensive,Chinese restaurant
Avi Bless,"Service was pathetic and truly disappointing.
My husband had ordered Chicken Tom yum Bowl n instead they had given vegetarian Tom yum bowl by mistake. After eating half of da food my husband realised der …",1 star,expensive,Chinese restaurant
Abhishek Dasgupta,"It's official today.. China Bistro Chembur food is anyday better than any of the Mainland China outlets there in Mumbai. People who know me, will understand the importance of this post when it comes to food. Thanks.",5 stars,expensive,Chinese restaurant
